id,title,authors,conference,year,official_page,pdf_link,status_or_award
ECCV2024-1717,FroSSL: Frobenius Norm Minimization for Efficient Multiview Self-Supervised Learning,Oscar Skean; Aayush Dhakal; Nathan Jacobs; Luis G Sanchez Giraldo,ECCV,2024,https://eccv.ecva.net/virtual/2024/poster/1189,https://www.ecva.net/papers/eccv_2024/papers_ECCV/papers/12410.pdf,2024 Poster
ECCV2024-1718,Learning Multimodal Latent Generative Models with Energy-Based Prior,Shiyu Yuan; Jiali Cui; Hanao Li; Tian Han,ECCV,2024,https://eccv.ecva.net/virtual/2024/poster/1621,https://www.ecva.net/papers/eccv_2024/papers_ECCV/papers/12427.pdf,2024 Poster
ECCV2024-1719,Hierarchical Conditioning of Diffusion Models Using Tree-of-Life for Studying Species Evolution,Mridul Khurana; Arka Daw; M. Maruf; Josef C. Uyeda; Wasila Dahdul; Caleb Charpentier; Yasin Bakış; Henry L. Bart; Paula M. Mabee; Hilmar Lapp; James P. Balhoff; Wei-Lun Chao; Charles Stewart; Tanya Berger-Wolf; Anuj Karpatne,ECCV,2024,https://eccv.ecva.net/virtual/2024/poster/2061,https://www.ecva.net/papers/eccv_2024/papers_ECCV/papers/12475.pdf,2024 Poster
ECCV2024-1720,Markov Knowledge Distillation: Make Nasty Teachers trained by Self-undermining Knowledge Distillation Fully Distillable,En-Hui Yang; Linfeng Ye,ECCV,2024,https://eccv.ecva.net/virtual/2024/poster/841,https://www.ecva.net/papers/eccv_2024/papers_ECCV/papers/12478.pdf,2024 Poster
ECCV2024-1721,CARFF: Conditional Auto-encoded Radiance Field for 3D Scene Forecasting,Jiezhi Yang; Khushi P Desai; Charles Packer; Harshil bhatia; Nicholas Rhinehart; Rowan McAllister; Joseph E Gonzalez,ECCV,2024,https://eccv.ecva.net/virtual/2024/poster/249,https://www.ecva.net/papers/eccv_2024/papers_ECCV/papers/12520.pdf,2024 Poster
ECCV2024-1722,Snuffy: Efficient Whole Slide Image Classifier,Hossein Jafarinia; Alireza Alipanah; Saeed Razavi; Nahal Mirzaie; Mohammad Rohban,ECCV,2024,https://eccv.ecva.net/virtual/2024/poster/1164,https://www.ecva.net/papers/eccv_2024/papers_ECCV/papers/12535.pdf,2024 Poster
ECCV2024-1723,Learning to Build by Building Your Own Instructions,Aaron Walsman; Muru Zhang; Adam Fishman; Ali Farhadi; Dieter Fox,ECCV,2024,https://eccv.ecva.net/virtual/2024/poster/2221,https://www.ecva.net/papers/eccv_2024/papers_ECCV/papers/12536.pdf,2024 Poster
ECCV2024-1724,Exploring Active Learning in Meta-Learning: Enhancing Context Set Labeling,Wonho Bae; Jing Wang; Danica J. Sutherland,ECCV,2024,https://eccv.ecva.net/virtual/2024/poster/2316,https://www.ecva.net/papers/eccv_2024/papers_ECCV/papers/12574.pdf,2024 Poster
ECCV2024-1725,BlenderAlchemy: Editing 3D Graphics with Vision-Language Models,Ian Huang; Guandao Yang; Leonidas Guibas,ECCV,2024,https://eccv.ecva.net/virtual/2024/poster/190,https://www.ecva.net/papers/eccv_2024/papers_ECCV/papers/12578.pdf,2024 Poster
ECCV2024-1726,CoTracker: It is Better to Track Together,Nikita Karaev; Ignacio Rocco; Ben Graham; Natalia Neverova; Andrea Vedaldi; Christian Rupprecht,ECCV,2024,https://eccv.ecva.net/virtual/2024/poster/1074,https://www.ecva.net/papers/eccv_2024/papers_ECCV/papers/07890.pdf,2024 Poster
ECCV2024-1727,Mesh2NeRF: Direct Mesh Supervision for Neural Radiance Field Representation and Generation,Yujin Chen; Yinyu Nie; Benjamin Ummenhofer; Reiner Birkl; Michael Paulitsch; Matthias Müller; Matthias Niessner,ECCV,2024,https://eccv.ecva.net/virtual/2024/poster/1314,https://www.ecva.net/papers/eccv_2024/papers_ECCV/papers/01394.pdf,2024 Poster
ECCV2024-1728,Unleashing Text-to-Image Diffusion Prior for Zero-Shot Image Captioning,Jianjie Luo; Jingwen Chen; Yehao Li; Yingwei Pan; Jianlin Feng; Hongyang Chao; Ting Yao,ECCV,2024,https://eccv.ecva.net/virtual/2024/poster/1866,https://www.ecva.net/papers/eccv_2024/papers_ECCV/papers/07445.pdf,2024 Poster
ECCV2024-1729,Improving Text-guided Object Inpainting with Semantic Pre-inpainting,Yifu Chen; Jingwen Chen; Yingwei Pan; Yehao Li; Ting Yao; Zhineng Chen; Tao Mei,ECCV,2024,https://eccv.ecva.net/virtual/2024/poster/675,https://www.ecva.net/papers/eccv_2024/papers_ECCV/papers/06251.pdf,2024 Poster
ECCV2024-1730,SpaRP: Fast 3D Object Reconstruction and Pose Estimation from Sparse Views,Chao Xu; Ang Li; Linghao Chen; Yulin Liu; Ruoxi Shi; Hao Su; Minghua Liu,ECCV,2024,https://eccv.ecva.net/virtual/2024/poster/2406,https://www.ecva.net/papers/eccv_2024/papers_ECCV/papers/08084.pdf,2024 Poster
ECCV2024-1731,SLEDGE: Synthesizing Driving Environments with Generative Models and Rule-Based Traffic,Kashyap Chitta; Daniel Dauner; Andreas Geiger,ECCV,2024,https://eccv.ecva.net/virtual/2024/poster/995,https://www.ecva.net/papers/eccv_2024/papers_ECCV/papers/00490.pdf,2024 Poster
ECCV2024-1732,LISO: Lidar-only Self-Supervised 3D Object Detection,Stefan Baur; Frank Moosmann; Andreas Geiger,ECCV,2024,https://eccv.ecva.net/virtual/2024/poster/1373,https://www.ecva.net/papers/eccv_2024/papers_ECCV/papers/11661.pdf,2024 Poster
ECCV2024-1733,Frontier-enhanced Topological Memory with Improved Exploration Awareness for Embodied Visual Navigation,Xinru Cui; Qiming Liu; Zhe Liu; Hesheng Wang,ECCV,2024,https://eccv.ecva.net/virtual/2024/poster/742,https://www.ecva.net/papers/eccv_2024/papers_ECCV/papers/08905.pdf,2024 Poster
ECCV2024-1734,Think2Drive: Efficient Reinforcement Learning by Thinking with Latent World Model for Autonomous Driving (in CARLA-v2),Qifeng Li; Xiaosong Jia; Shaobo Wang; Junchi Yan,ECCV,2024,https://eccv.ecva.net/virtual/2024/poster/1383,https://www.ecva.net/papers/eccv_2024/papers_ECCV/papers/06129.pdf,2024 Poster
ECCV2024-1735,LookupViT: Compressing visual information to a limited number of tokens,Rajat Koner; Gagan Jain; Sujoy Paul; Volker Tresp; Prateek Jain,ECCV,2024,https://eccv.ecva.net/virtual/2024/poster/760,https://www.ecva.net/papers/eccv_2024/papers_ECCV/papers/11673.pdf,2024 Poster
ECCV2024-1736,Pixel-Aware Stable Diffusion for Realistic Image Super-Resolution and Personalized Stylization,Tao Yang; Rongyuan Wu; Peiran Ren; Xuansong Xie; Yabin Zhang,ECCV,2024,https://eccv.ecva.net/virtual/2024/poster/1428,https://www.ecva.net/papers/eccv_2024/papers_ECCV/papers/01705.pdf,2024 Poster
ECCV2024-1737,REDIR: Refocus-free Event-based De-occlusion Image Reconstruction,Qi Guo; Hailong Shi; Huan Li; Jinsheng Xiao; Xingyu Gao,ECCV,2024,https://eccv.ecva.net/virtual/2024/poster/2118,https://www.ecva.net/papers/eccv_2024/papers_ECCV/papers/10433.pdf,2024 Poster
ECCV2024-1738,Towards compact reversible image representations for neural style transfer,Xiyao Liu; Siyu Yang; Jian Zhang; Gerald Schaefer; Jiya Li; Xunli FAN; Songtao Wu; Hui Fang,ECCV,2024,https://eccv.ecva.net/virtual/2024/poster/1409,https://www.ecva.net/papers/eccv_2024/papers_ECCV/papers/08321.pdf,2024 Poster
ECCV2024-1739,InsMapper: Exploring Inner-instance Information for Vectorized HD Mapping,Zhenhua Xu; Kwan-Yee K. Wong; Hengshuang ZHAO,ECCV,2024,https://eccv.ecva.net/virtual/2024/poster/641,https://www.ecva.net/papers/eccv_2024/papers_ECCV/papers/05030.pdf,2024 Poster
ECCV2024-1740,Exploring Vulnerabilities in Spiking Neural Networks: Direct Adversarial Attacks on Raw Event Data,Yanmeng Yao; Xiaohan Zhao; Bin Gu,ECCV,2024,https://eccv.ecva.net/virtual/2024/poster/1447,https://www.ecva.net/papers/eccv_2024/papers_ECCV/papers/09164.pdf,2024 Poster
ECCV2024-1741,MRSP: Learn Multi-Representations of Single Primitive for Compositional Zero-Shot Learning,Dongyao Jiang; Hui Chen; Haodong Jing; Yongqiang Ma; Nanning Zheng,ECCV,2024,https://eccv.ecva.net/virtual/2024/poster/1469,https://www.ecva.net/papers/eccv_2024/papers_ECCV/papers/08153.pdf,2024 Poster
ECCV2024-1742,GRIDS: Grouped Multiple-Degradation Restoration with Image Degradation Similarity,Shuo Cao; Yihao Liu; Wenlong Zhang; Yu Qiao; Chao Dong,ECCV,2024,https://eccv.ecva.net/virtual/2024/poster/305,https://www.ecva.net/papers/eccv_2024/papers_ECCV/papers/08838.pdf,2024 Poster
ECCV2024-1743,KDProR: A Knowledge-Decoupling Probabilistic Framework for Video-Text Retrieval,Xianwei Zhuang; Hongxiang Li; Xuxin Cheng; Zhihong Zhu; Yuxin Xie; Yuexian Zou,ECCV,2024,https://eccv.ecva.net/virtual/2024/poster/1475,https://www.ecva.net/papers/eccv_2024/papers_ECCV/papers/05033.pdf,2024 Poster
ECCV2024-1744,The First to Know: How Token Distributions Reveal Hidden Knowledge in Large Vision-Language Models?,Qinyu Zhao; Ming Xu; Kartik Gupta; Akshay Asthana; Liang Zheng; Stephen Gould,ECCV,2024,https://eccv.ecva.net/virtual/2024/poster/1115,https://www.ecva.net/papers/eccv_2024/papers_ECCV/papers/06429.pdf,2024 Poster
ECCV2024-1745,VLAD-BuFF: Burst-aware Fast Feature Aggregation for Visual Place Recognition,Ahmad Khaliq; Ming Xu; Stephen Hausler; Michael J Milford; Sourav Garg,ECCV,2024,https://eccv.ecva.net/virtual/2024/poster/1484,https://www.ecva.net/papers/eccv_2024/papers_ECCV/papers/06086.pdf,2024 Poster
ECCV2024-1746,Mask as Supervision: Leveraging Unified Mask Information for Unsupervised 3D Pose Estimation,Yuchen Yang; Yu Qiao; Xiao Sun,ECCV,2024,https://eccv.ecva.net/virtual/2024/poster/1354,https://www.ecva.net/papers/eccv_2024/papers_ECCV/papers/06027.pdf,2024 Poster
ECCV2024-1747,Better Regression Makes Better Test-time Adaptive 3D Object Detection,Jiakang Yuan; Bo Zhang; Kaixiong Gong; Xiangyu Yue; Botian Shi; Yu Qiao; Tao Chen,ECCV,2024,https://eccv.ecva.net/virtual/2024/poster/423,https://www.ecva.net/papers/eccv_2024/papers_ECCV/papers/05971.pdf,2024 Poster
ECCV2024-1748,Temporally Consistent Stereo Matching,Jiaxi Zeng; Chengtang Yao; Yuwei Wu; Yunde Jia,ECCV,2024,https://eccv.ecva.net/virtual/2024/poster/256,https://www.ecva.net/papers/eccv_2024/papers_ECCV/papers/04579.pdf,2024 Poster
ECCV2024-1749,ViGoR: Improving Visual Grounding of Large Vision Language Models with Fine-Grained Reward Modeling,Siming Yan; Min Bai; Weifeng Chen; Xiong Zhou; Qixing Huang; Li Erran Li,ECCV,2024,https://eccv.ecva.net/virtual/2024/poster/1495,https://www.ecva.net/papers/eccv_2024/papers_ECCV/papers/07792.pdf,2024 Poster
ECCV2024-1750,Learning Scalable Model Soup on a Single GPU: An Efficient Subspace Training Strategy,Tao Li; Weisen Jiang; Fanghui Liu; Xiaolin Huang; James Kwok,ECCV,2024,https://eccv.ecva.net/virtual/2024/poster/1205,https://www.ecva.net/papers/eccv_2024/papers_ECCV/papers/08257.pdf,2024 Poster
ECCV2024-1751,ScatterFormer: Efficient Voxel Transformer with Scattered Linear Attention,Chenhang He; Ruihuang Li; Guowen Zhang; Yabin Zhang,ECCV,2024,https://eccv.ecva.net/virtual/2024/poster/2435,https://www.ecva.net/papers/eccv_2024/papers_ECCV/papers/04159.pdf,2024 Poster
ECCV2024-1752,Asynchronous Large Language Model Enhanced Planner for Autonomous Driving,Yuan Chen; Zi-han Ding; Ziqin Wang; Yan Wang; Lijun Zhang; Si Liu,ECCV,2024,https://eccv.ecva.net/virtual/2024/poster/743,https://www.ecva.net/papers/eccv_2024/papers_ECCV/papers/05239.pdf,2024 Poster
ECCV2024-1753,Benchmarking Spurious Bias in Few-Shot Image Classifiers,Guangtao Zheng; Wenqian Ye; Aidong Zhang,ECCV,2024,https://eccv.ecva.net/virtual/2024/poster/1190,https://www.ecva.net/papers/eccv_2024/papers_ECCV/papers/10418.pdf,2024 Poster
ECCV2024-1754,Deep Companion Learning: Enhancing Generalization Through Historical Consistency,Ruizhao Zhu; Venkatesh Saligrama,ECCV,2024,https://eccv.ecva.net/virtual/2024/poster/1204,https://www.ecva.net/papers/eccv_2024/papers_ECCV/papers/05472.pdf,2024 Poster
ECCV2024-1755,WSI-VQA: Interpreting Whole Slide Images by Generative Visual Question Answering,Pingyi Chen; Chenglu Zhu; Sunyi Zheng; Honglin Li; Lin Yang,ECCV,2024,https://eccv.ecva.net/virtual/2024/poster/1542,https://www.ecva.net/papers/eccv_2024/papers_ECCV/papers/05355.pdf,2024 Poster
ECCV2024-1756,Straightforward Layer-wise Pruning for More Efficient Visual Adaptation,Ruizi Han; Jinglei Tang,ECCV,2024,https://eccv.ecva.net/virtual/2024/poster/1555,https://www.ecva.net/papers/eccv_2024/papers_ECCV/papers/09113.pdf,2024 Poster
ECCV2024-1757,ABC Easy as 123: A Blind Counter for Exemplar-Free Multi-Class Class-agnostic Counting,Michael A Hobley; Victor Adrian Prisacariu,ECCV,2024,https://eccv.ecva.net/virtual/2024/poster/118,https://www.ecva.net/papers/eccv_2024/papers_ECCV/papers/01761.pdf,2024 Poster
ECCV2024-1758,CrossScore: A Multi-View Approach to Image Evaluation and Scoring,Zirui Wang; Wenjing Bian; Victor Adrian Prisacariu,ECCV,2024,https://eccv.ecva.net/virtual/2024/poster/1491,https://www.ecva.net/papers/eccv_2024/papers_ECCV/papers/01470.pdf,2024 Poster
ECCV2024-1759,CPM: Class-conditional Prompting Machine for Audio-visual Segmentation,Yuanhong Chen; Chong Wang; Yuyuan Liu; Hu Wang; Gustavo Carneiro,ECCV,2024,https://eccv.ecva.net/virtual/2024/poster/349,https://www.ecva.net/papers/eccv_2024/papers_ECCV/papers/01634.pdf,2024 Poster
ECCV2024-1760,DiffClass: Diffusion-Based Class Incremental Learning,Zichong Meng; Jie Zhang; Changdi Yang; Zheng Zhan; Pu Zhao; Yanzhi Wang,ECCV,2024,https://eccv.ecva.net/virtual/2024/poster/1572,https://www.ecva.net/papers/eccv_2024/papers_ECCV/papers/11819.pdf,2024 Poster
ECCV2024-1761,Dual-Decoupling Learning and Metric-Adaptive Thresholding for Semi-Supervised Multi-Label Learning,Jiahao Xiao; Ming-Kun Xie; Heng-Bo Fan; Gang Niu; Masashi Sugiyama; Sheng-Jun Huang,ECCV,2024,https://eccv.ecva.net/virtual/2024/poster/1567,https://www.ecva.net/papers/eccv_2024/papers_ECCV/papers/06917.pdf,2024 Poster
ECCV2024-1762,PromptFusion: Decoupling Stability and Plasticity for Continual Learning,Haoran Chen; Zuxuan Wu; Xintong Han; Menglin Jia; Yu-Gang Jiang,ECCV,2024,https://eccv.ecva.net/virtual/2024/poster/1576,https://www.ecva.net/papers/eccv_2024/papers_ECCV/papers/11826.pdf,2024 Poster
ECCV2024-1763,SEGIC: Unleashing the Emergent Correspondence for In-Context Segmentation,Lingchen Meng; Shiyi Lan; Hengduo Li; Jose M Alvarez; Zuxuan Wu; Yu-Gang Jiang,ECCV,2024,https://eccv.ecva.net/virtual/2024/poster/2262,https://www.ecva.net/papers/eccv_2024/papers_ECCV/papers/05519.pdf,2024 Poster
ECCV2024-1764,Infinite-ID: Identity-preserved Personalization via ID-semantics Decoupling Paradigm,Yi Wu; Ziqiang Li; Heliang Zheng; Chaoyue Wang; Bin Li,ECCV,2024,https://eccv.ecva.net/virtual/2024/poster/287,https://www.ecva.net/papers/eccv_2024/papers_ECCV/papers/01291.pdf,2024 Poster
ECCV2024-1765,PFGS: High Fidelity Point Cloud Rendering via Feature Splatting,Jiaxu Wang; Zhang Ziyi; Junhao He; Renjing Xu,ECCV,2024,https://eccv.ecva.net/virtual/2024/poster/1687,https://www.ecva.net/papers/eccv_2024/papers_ECCV/papers/10987.pdf,2024 Poster
ECCV2024-1766,DGE: Direct Gaussian 3D Editing by Consistent Multi-view Editing,Minghao Chen; Iro Laina; Andrea Vedaldi,ECCV,2024,https://eccv.ecva.net/virtual/2024/poster/2412,https://www.ecva.net/papers/eccv_2024/papers_ECCV/papers/09386.pdf,2024 Poster
ECCV2024-1767,Handling The Non-Smooth Challenge in Tensor SVD: A Multi-Objective Tensor Recovery Framework,Jingjing Zheng; Wanglong Lu; Wenzhe Wang; Yankai Cao; Xiaoqin Zhang; Xianta Jiang,ECCV,2024,https://eccv.ecva.net/virtual/2024/poster/706,https://www.ecva.net/papers/eccv_2024/papers_ECCV/papers/02249.pdf,2024 Poster
ECCV2024-1768,DA-BEV: Unsupervised Domain Adaptation for Bird's Eye View Perception,Kai Jiang; Jiaxing Huang; Weiying Xie; Jie Lei; Yunsong Li; Ling Shao; Shijian Lu,ECCV,2024,https://eccv.ecva.net/virtual/2024/poster/980,https://www.ecva.net/papers/eccv_2024/papers_ECCV/papers/10792.pdf,2024 Poster
ECCV2024-1769,PILoRA: Prototype Guided Incremental LoRA for Federated Class-Incremental Learning,Haiyang Guo; Fei Zhu; Wenzhuo Liu; Xu-Yao Zhang; Cheng-Lin Liu,ECCV,2024,https://eccv.ecva.net/virtual/2024/poster/1575,https://www.ecva.net/papers/eccv_2024/papers_ECCV/papers/08185.pdf,2024 Poster
ECCV2024-1770,Exploring the Feature Extraction and Relation Modeling For Light-Weight Transformer Tracking,Jikai Zheng; Mingjiang Liang; Shaoli Huang; Jifeng Ning,ECCV,2024,https://eccv.ecva.net/virtual/2024/poster/1619,https://www.ecva.net/papers/eccv_2024/papers_ECCV/papers/04168.pdf,2024 Poster
ECCV2024-1771,Data Augmentation via Latent Diffusion for Saliency Prediction,Bahar Aydemir; Deblina Bhattacharjee; Tong Zhang; Mathieu Salzmann; Sabine Süsstrunk,ECCV,2024,https://eccv.ecva.net/virtual/2024/poster/2521,https://www.ecva.net/papers/eccv_2024/papers_ECCV/papers/10071.pdf,2024 Poster
ECCV2024-1772,PiTe: Pixel-Temporal Alignment for Large Video-Language Model,Yang Liu; Pengxiang Ding; Siteng Huang; Min Zhang; Han Zhao; Donglin Wang,ECCV,2024,https://eccv.ecva.net/virtual/2024/poster/1629,https://www.ecva.net/papers/eccv_2024/papers_ECCV/papers/00744.pdf,2024 Poster
ECCV2024-1773,3D Gaussian Parametric Head Model,Yuelang Xu; Lizhen Wang; Zerong Zheng; Zhaoqi Su; Yebin Liu,ECCV,2024,https://eccv.ecva.net/virtual/2024/poster/545,https://www.ecva.net/papers/eccv_2024/papers_ECCV/papers/05133.pdf,2024 Poster
ECCV2024-1774,Dynamic Neural Radiance Field From Defocused Monocular Video,Xianrui Luo; Huiqiang Sun; Juewen Peng; Zhiguo Cao,ECCV,2024,https://eccv.ecva.net/virtual/2024/poster/1649,https://www.ecva.net/papers/eccv_2024/papers_ECCV/papers/00742.pdf,2024 Poster
ECCV2024-1775,Retargeting Visual Data with Deformation Fields,Tim Elsner; Julia Berger; Tong Wu; Victor Czech; LIN GAO; Leif Kobbelt,ECCV,2024,https://eccv.ecva.net/virtual/2024/poster/1316,https://www.ecva.net/papers/eccv_2024/papers_ECCV/papers/07118.pdf,2024 Poster
ECCV2024-1776,Ray-Distance Volume Rendering for Neural Scene Reconstruction,Ruihong Yin; Yunlu Chen; Sezer Karaoglu; Theo Gevers,ECCV,2024,https://eccv.ecva.net/virtual/2024/poster/165,https://www.ecva.net/papers/eccv_2024/papers_ECCV/papers/02234.pdf,2024 Poster
ECCV2024-1777,4Diff: 3D-Aware Diffusion Model for Third-to-First Viewpoint Translation,Feng Cheng; Mi Luo; Huiyu Wang; Alex Dimakis; Lorenzo Torresani; Gedas Bertasius; Kristen Grauman,ECCV,2024,https://eccv.ecva.net/virtual/2024/poster/1665,https://www.ecva.net/papers/eccv_2024/papers_ECCV/papers/03536.pdf,2024 Poster
ECCV2024-1778,Spike-Temporal Latent Representation for Energy-Efficient Event-to-Video Reconstruction,Jianxiong Tang; Jian-Huang Lai; Lingxiao Yang; Xiaohua Xie,ECCV,2024,https://eccv.ecva.net/virtual/2024/poster/1446,https://www.ecva.net/papers/eccv_2024/papers_ECCV/papers/05843.pdf,2024 Poster
ECCV2024-1779,Sur^2f: A Hybrid Representation for High-Quality and Efficient Surface Reconstruction from Multi-view Images,Zhangjin Huang; Zhihao Liang; Kui Jia,ECCV,2024,https://eccv.ecva.net/virtual/2024/poster/172,https://www.ecva.net/papers/eccv_2024/papers_ECCV/papers/07696.pdf,2024 Poster
ECCV2024-1780,ProDepth: Boosting Self-Supervised Multi-Frame Monocular Depth with Probabilistic Fusion,Sungmin Woo; Wonjoon Lee; Woo Jin Kim; Dogyoon Lee; Sangyoun Lee,ECCV,2024,https://eccv.ecva.net/virtual/2024/poster/1365,https://www.ecva.net/papers/eccv_2024/papers_ECCV/papers/00367.pdf,2024 Poster
ECCV2024-1781,Realistic Human Motion Generation with Cross-Diffusion Models,Zeping Ren; Shaoli Huang; Xiu Li,ECCV,2024,https://eccv.ecva.net/virtual/2024/poster/265,https://www.ecva.net/papers/eccv_2024/papers_ECCV/papers/03045.pdf,2024 Poster
ECCV2024-1782,SAM4MLLM: Enhance Multi-Modal Large Language Model for Referring Expression Segmentation,Yi-Chia Chen; WeiHua Li; Cheng Sun; Yu-Chiang Frank Wang; Chu-Song Chen,ECCV,2024,https://eccv.ecva.net/virtual/2024/poster/1139,https://www.ecva.net/papers/eccv_2024/papers_ECCV/papers/10570.pdf,2024 Poster
ECCV2024-1783,Continuous Memory Representation for Anomaly Detection,Joo Chan Lee; Taejune Kim; Eunbyung Park; Simon S Woo; Jong Hwan Ko,ECCV,2024,https://eccv.ecva.net/virtual/2024/poster/808,https://www.ecva.net/papers/eccv_2024/papers_ECCV/papers/06826.pdf,2024 Poster
ECCV2024-1784,UniTalker: Scaling up Audio-Driven 3D Facial Animation through A Unified Model,Xiangyu Fan; Jiaqi Li; Zhiqian Lin; Weiye Xiao; Lei Yang,ECCV,2024,https://eccv.ecva.net/virtual/2024/poster/154,https://www.ecva.net/papers/eccv_2024/papers_ECCV/papers/05747.pdf,2024 Poster
ECCV2024-1785,Diffusion Reward: Learning Rewards via Conditional Video Diffusion,Tao Huang; Guangqi Jiang; Yanjie Ze; Huazhe Xu,ECCV,2024,https://eccv.ecva.net/virtual/2024/poster/261,https://www.ecva.net/papers/eccv_2024/papers_ECCV/papers/05914.pdf,2024 Poster
ECCV2024-1786,Efficient Depth-Guided Urban View Synthesis,sheng miao; Jiaxin Huang; Dongfeng Bai; Weichao Qiu; Liu Bingbing; Andreas Geiger; Yiyi Liao,ECCV,2024,https://eccv.ecva.net/virtual/2024/poster/164,https://www.ecva.net/papers/eccv_2024/papers_ECCV/papers/04325.pdf,2024 Poster
ECCV2024-1787,OneRestore: A Universal Restoration Framework for Composite Degradation,Yu Guo; Yuan Gao; Yuxu Lu; Huilin Zhu; Wen Liu; Shengfeng He,ECCV,2024,https://eccv.ecva.net/virtual/2024/poster/1436,https://www.ecva.net/papers/eccv_2024/papers_ECCV/papers/02906.pdf,2024 Poster
ECCV2024-1788,Accelerating Online Mapping and Behavior Prediction via Direct BEV Feature Attention,Xunjiang Gu; Guanyu Song; Igor Gilitschenski; Marco Pavone; Boris Ivanovic,ECCV,2024,https://eccv.ecva.net/virtual/2024/poster/1735,https://www.ecva.net/papers/eccv_2024/papers_ECCV/papers/10635.pdf,2024 Poster
ECCV2024-1789,Beyond MOT: Semantic Multi-Object Tracking,Yunhao Li; Qin Li; Hao Wang; Xue Ma; Jiali Yao; Shaohua Dong; Heng Fan; Libo Zhang,ECCV,2024,https://eccv.ecva.net/virtual/2024/poster/1468,https://www.ecva.net/papers/eccv_2024/papers_ECCV/papers/05182.pdf,2024 Poster
ECCV2024-1790,PartCraft: Crafting Creative Objects by Parts,Kam Woh Ng; Xiatian Zhu; Yi-Zhe Song; Tao Xiang,ECCV,2024,https://eccv.ecva.net/virtual/2024/poster/280,https://www.ecva.net/papers/eccv_2024/papers_ECCV/papers/01451.pdf,2024 Poster
ECCV2024-1791,WordRobe: Text-Guided Generation of Textured 3D Garments,Astitva Srivastava; Pranav Manu; Amit Raj; Varun Jampani; Avinash Sharma,ECCV,2024,https://eccv.ecva.net/virtual/2024/poster/195,https://www.ecva.net/papers/eccv_2024/papers_ECCV/papers/00151.pdf,2024 Poster
ECCV2024-1792,ZeST: Zero-Shot Material Transfer from a Single Image,Ta-Ying Cheng; Prafull Sharma; Andrew Markham; Niki Trigoni; Varun Jampani,ECCV,2024,https://eccv.ecva.net/virtual/2024/poster/296,https://www.ecva.net/papers/eccv_2024/papers_ECCV/papers/00144.pdf,2024 Poster
ECCV2024-1793,AnyControl: Create Your Artwork with Versatile Control on Text-to-Image Generation,Sun Yanan; Yanchen Liu; Yinhao Tang; Wenjie Pei; Kai Chen,ECCV,2024,https://eccv.ecva.net/virtual/2024/poster/1763,https://www.ecva.net/papers/eccv_2024/papers_ECCV/papers/01706.pdf,2024 Poster
ECCV2024-1794,UDA-Bench: Revisiting Common Assumptions in Unsupervised Domain Adaptation Using a Standardized Framework,Tarun Kalluri; Sreyas Ravichandran; Manmohan Chandraker,ECCV,2024,https://eccv.ecva.net/virtual/2024/poster/461,https://www.ecva.net/papers/eccv_2024/papers_ECCV/papers/11391.pdf,2024 Poster
ECCV2024-1795,Online Continuous Generalized Category Discovery,Keon-Hee Park; Hakyung Lee; Kyungwoo Song; Gyeong-Moon Park,ECCV,2024,https://eccv.ecva.net/virtual/2024/poster/459,https://www.ecva.net/papers/eccv_2024/papers_ECCV/papers/10490.pdf,2024 Poster
ECCV2024-1796,AddMe: Zero-shot Group-photo Synthesis by Inserting People into Scenes,Dongxu Yue; Maomao Li; Yunfei Liu; AILING ZENG; Tianyu Yang; Qin Guo; Yu Li,ECCV,2024,https://eccv.ecva.net/virtual/2024/poster/684,https://www.ecva.net/papers/eccv_2024/papers_ECCV/papers/03028.pdf,2024 Poster
ECCV2024-1797,Ponymation: Learning Articulated 3D Animal Motions from Unlabeled Online Videos,Keqiang Sun; Dori Litvak; Yunzhi Zhang; Hongsheng LI; Jiajun Wu; Shangzhe Wu,ECCV,2024,https://eccv.ecva.net/virtual/2024/poster/591,https://www.ecva.net/papers/eccv_2024/papers_ECCV/papers/00029.pdf,2024 Poster
ECCV2024-1798,Challenging Forgets: Unveiling the Worst-Case Forget Sets in Machine Unlearning,Chongyu Fan; Jiancheng Liu; Alfred Hero; Sijia Liu,ECCV,2024,https://eccv.ecva.net/virtual/2024/poster/1212,https://www.ecva.net/papers/eccv_2024/papers_ECCV/papers/03171.pdf,2024 Poster
ECCV2024-1799,KFD-NeRF: Rethinking Dynamic NeRF with Kalman Filter,Yifan Zhan; Zhuoxiao Li; Muyao Niu; Zhihang Zhong; Shohei Nobuhara; Ko Nishino; zheng yinqiang,ECCV,2024,https://eccv.ecva.net/virtual/2024/poster/1295,https://www.ecva.net/papers/eccv_2024/papers_ECCV/papers/06103.pdf,2024 Poster
ECCV2024-1800,MERLiN: Single-Shot Material Estimation and Relighting for Photometric Stereo,Ashish Tiwari; Satoshi Ikehata; Shanmuganathan Raman,ECCV,2024,https://eccv.ecva.net/virtual/2024/poster/1298,https://www.ecva.net/papers/eccv_2024/papers_ECCV/papers/01894.pdf,2024 Poster
ECCV2024-1801,MC-PanDA: Mask Confidence for Panoptic Domain Adaptation,Ivan Martinovic; Josip Šarić; Siniša Šegvić,ECCV,2024,https://eccv.ecva.net/virtual/2024/poster/1525,https://www.ecva.net/papers/eccv_2024/papers_ECCV/papers/09103.pdf,2024 Poster
ECCV2024-1802,GaussianImage: 1000 FPS Image Representation and Compression by 2D Gaussian Splatting,XINJIE ZHANG; Xingtong Ge; Tongda Xu; Dailan He; Yan Wang; Hongwei Qin; Guo Lu; Jing Geng; Jun Zhang,ECCV,2024,https://eccv.ecva.net/virtual/2024/poster/179,https://www.ecva.net/papers/eccv_2024/papers_ECCV/papers/01421.pdf,2024 Poster
ECCV2024-1803,Data Overfitting for On-Device Super-Resolution with Dynamic Algorithm and Compiler Co-Design,Li; zhihao shu; Jie Ji; Minghai Qin; Fatemeh Afghah; Wei Niu; Xiaolong Ma,ECCV,2024,https://eccv.ecva.net/virtual/2024/poster/1803,https://www.ecva.net/papers/eccv_2024/papers_ECCV/papers/08448.pdf,2024 Poster
ECCV2024-1804,BI-MDRG: Bridging Image History in Multimodal Dialogue Response Generation,Hee Suk Yoon; Eunseop Yoon; Joshua Tian Jin Tee; Kang Zhang; Yu-Jung Heo; Du-Seong Chang; Chang Yoo,ECCV,2024,https://eccv.ecva.net/virtual/2024/poster/1110,https://www.ecva.net/papers/eccv_2024/papers_ECCV/papers/04591.pdf,2024 Poster
ECCV2024-1805,PRET: Planning with Directed Fidelity Trajectory for Vision and Language Navigation,Renjie Lu; Jing-Ke Meng; WEISHI ZHENG,ECCV,2024,https://eccv.ecva.net/virtual/2024/poster/357,https://www.ecva.net/papers/eccv_2024/papers_ECCV/papers/08287.pdf,2024 Poster
