id,title,authors,conference,year,official_page,pdf_link,status_or_award
ECCV2024-0001,4D Contrastive Superflows are Dense 3D Representation Learners,Xiang Xu; Lingdong Kong; Hui Shuai; Wenwei Zhang; Liang Pan; Kai Chen; Ziwei Liu; Qingshan Liu,ECCV,2024,https://eccv.ecva.net/virtual/2024/poster/238,https://www.ecva.net/papers/eccv_2024/papers_ECCV/papers/00019.pdf,2024 Poster
ECCV2024-0002,Octopus: Embodied Vision-Language Programmer from Environmental Feedback,Jingkang Yang; Yuhao Dong; Shuai Liu; Bo Li; Ziyue Wang; ChenCheng Jiang; Haoran Tan; Jiamu Kang; Yuanhan Zhang; Kaiyang Zhou; Ziwei Liu,ECCV,2024,https://eccv.ecva.net/virtual/2024/poster/1486,https://www.ecva.net/papers/eccv_2024/papers_ECCV/papers/00006.pdf,2024 Poster
ECCV2024-0003,ItTakesTwo: Leveraging Peer Representations for Semi-supervised LiDAR Semantic Segmentation,Yuyuan Liu; Yuanhong Chen; Hu Wang; Vasileios Belagiannis; Ian Reid; Gustavo Carneiro,ECCV,2024,https://eccv.ecva.net/virtual/2024/poster/1530,https://www.ecva.net/papers/eccv_2024/papers_ECCV/papers/00022.pdf,2024 Poster
ECCV2024-0004,Weakly Supervised 3D Object Detection via Multi-Level Visual Guidance,Kuan-Chih Huang; Yi-Hsuan Tsai; Ming-Hsuan Yang,ECCV,2024,https://eccv.ecva.net/virtual/2024/poster/1723,https://www.ecva.net/papers/eccv_2024/papers_ECCV/papers/00055.pdf,2024 Poster
ECCV2024-0005,Modeling and Driving Human Body Soundfields through Acoustic Primitives,Chao Huang; Dejan Markovic; Chenliang Xu; Alexander Richard,ECCV,2024,https://eccv.ecva.net/virtual/2024/poster/1280,https://www.ecva.net/papers/eccv_2024/papers_ECCV/papers/01481.pdf,2024 Poster
ECCV2024-0006,Motion Mamba: Efficient and Long Sequence Motion Generation,Zeyu Zhang; Akide Liu; Ian Reid; Richard Hartley; Bohan Zhuang; Hao Tang,ECCV,2024,https://eccv.ecva.net/virtual/2024/poster/655,https://www.ecva.net/papers/eccv_2024/papers_ECCV/papers/00100.pdf,2024 Poster
ECCV2024-0007,Learning to Generate Conditional Tri-plane for 3D-aware Expression Controllable Portrait Animation,Taekyung Ki; Dongchan Min; Gyeongsu Chae,ECCV,2024,https://eccv.ecva.net/virtual/2024/poster/1640,https://www.ecva.net/papers/eccv_2024/papers_ECCV/papers/00159.pdf,2024 Poster
ECCV2024-0008,SAGS: Structure-Aware 3D Gaussian Splatting,Evangelos Ververas; Rolandos Alexandros Potamias; Song Jifei; Jiankang Deng; Stefanos Zafeiriou,ECCV,2024,https://eccv.ecva.net/virtual/2024/poster/1304,https://www.ecva.net/papers/eccv_2024/papers_ECCV/papers/02887.pdf,2024 Poster
ECCV2024-0009,MSD: A Benchmark Dataset for Floor Plan Generation of Building Complexes,Casper van Engelenburg; Fatemeh Mostafavi; Emanuel Kuhn; Yuntae Jeon; Michael Franzen; Matthias Standfest; Jan Gemert; Seyran Khademi,ECCV,2024,https://eccv.ecva.net/virtual/2024/poster/2064,https://www.ecva.net/papers/eccv_2024/papers_ECCV/papers/07514.pdf,2024 Poster
ECCV2024-0010,Guide-and-Rescale: Self-Guidance Mechanism for Effective Tuning-Free Real Image Editing,Vadim Titov; Madina Khalmatova; Alexandra Ivanova; Dmitry P Vetrov; Aibek Alanov,ECCV,2024,https://eccv.ecva.net/virtual/2024/poster/1408,https://www.ecva.net/papers/eccv_2024/papers_ECCV/papers/08987.pdf,2024 Poster
ECCV2024-0011,3DGazeNet: Generalizing Gaze Estimation with Weak Supervision from Synthetic Views,Evangelos Ververas; Polydefkis Gkagkos; Jiankang Deng; Michail C Doukas; Jia Guo; Stefanos Zafeiriou,ECCV,2024,https://eccv.ecva.net/virtual/2024/poster/2247,https://www.ecva.net/papers/eccv_2024/papers_ECCV/papers/03191.pdf,2024 Poster
ECCV2024-0012,Generating Physically Realistic and Directable Human Motions from Multi-Modal Inputs,Aayam Shrestha; Pan Liu; German Ros; Kai Yuan; Alan Fern,ECCV,2024,https://eccv.ecva.net/virtual/2024/poster/1393,https://www.ecva.net/papers/eccv_2024/papers_ECCV/papers/07885.pdf,2024 Poster
ECCV2024-0013,Enhancing Perceptual Quality in Video Super-Resolution through Temporally-Consistent Detail Synthesis using Diffusion Models,Claudio Rota; Marco Buzzelli; Joost Van de Weijer,ECCV,2024,https://eccv.ecva.net/virtual/2024/poster/1051,https://www.ecva.net/papers/eccv_2024/papers_ECCV/papers/01824.pdf,2024 Poster
ECCV2024-0014,Disentangling Masked Autoencoders for Unsupervised Domain Generalization,An Zhang; Han Wang; Xiang Wang; Tat-Seng Chua,ECCV,2024,https://eccv.ecva.net/virtual/2024/poster/836,https://www.ecva.net/papers/eccv_2024/papers_ECCV/papers/08861.pdf,2024 Poster
ECCV2024-0015,SemGrasp: Semantic Grasp Generation via Language Aligned Discretization,Kailin Li; Jingbo Wang; Lixin Yang; Cewu Lu; Bo Dai,ECCV,2024,https://eccv.ecva.net/virtual/2024/poster/1361,https://www.ecva.net/papers/eccv_2024/papers_ECCV/papers/00193.pdf,2024 Poster
ECCV2024-0016,BAM-DETR: Boundary-Aligned Moment Detection Transformer for Temporal Sentence Grounding in Videos,Pilhyeon Lee; Hyeran Byun,ECCV,2024,https://eccv.ecva.net/virtual/2024/poster/2577,https://www.ecva.net/papers/eccv_2024/papers_ECCV/papers/00212.pdf,2024 Poster
ECCV2024-0017,Optimizing Factorized Encoder Models: Time and Memory Reduction for Scalable and Efficient Action Recognition,Shreyank Narayana Gowda; Anurag Arnab; Jonathan Huang,ECCV,2024,https://eccv.ecva.net/virtual/2024/poster/1470,https://www.ecva.net/papers/eccv_2024/papers_ECCV/papers/01635.pdf,2024 Poster
ECCV2024-0018,MarineInst: A Foundation Model for Marine Image Analysis with Instance Visual Description,Ziqiang Zheng; Yiwei Chen; Huimin Zeng; Tuan-Anh Vu; Binh-Son Hua; Sai Kit Yeung,ECCV,2024,https://eccv.ecva.net/virtual/2024/poster/865,https://www.ecva.net/papers/eccv_2024/papers_ECCV/papers/00223.pdf,2024 Poster
ECCV2024-0019,BRAVE: Broadening the visual encoding of vision-language models,Oguzhan Fatih Kar; Alessio Tonioni; Petra Poklukar; Achin Kulshrestha; Amir Zamir; Federico Tombari,ECCV,2024,https://eccv.ecva.net/virtual/2024/poster/2001,https://www.ecva.net/papers/eccv_2024/papers_ECCV/papers/02433.pdf,2024 Poster
ECCV2024-0020,Motion-prior Contrast Maximization for Dense Continuous-Time Motion Estimation,Friedhelm Hamann; Ziyun Wang; Ioannis Asmanis; Kenneth Chaney; Guillermo Gallego; Kostas Daniilidis,ECCV,2024,https://eccv.ecva.net/virtual/2024/poster/1740,https://www.ecva.net/papers/eccv_2024/papers_ECCV/papers/00304.pdf,2024 Poster
ECCV2024-0021,SplatFields: Neural Gaussian Splats for Sparse 3D and 4D Reconstruction,Marko Mihajlovic; Sergey Prokudin; Siyu Tang; Robert Maier; Federica Bogo; Tony Tung; Edmond Boyer,ECCV,2024,https://eccv.ecva.net/virtual/2024/poster/914,https://www.ecva.net/papers/eccv_2024/papers_ECCV/papers/00254.pdf,2024 Poster
ECCV2024-0022,CPT-VR: Improving Surface Rendering via Closest Point Transform with View-Reflection Appearance,Zhipeng Hu; Yongqiang Zhang; Chen Liu; Lincheng Li; Sida Peng; Xiaowei Zhou; Changjie Fan; Xin Yu,ECCV,2024,https://eccv.ecva.net/virtual/2024/poster/561,https://www.ecva.net/papers/eccv_2024/papers_ECCV/papers/09272.pdf,2024 Poster
ECCV2024-0023,OGNI-DC: Robust Depth Completion with Optimization-Guided Neural Iterations,Yiming Zuo; Jia Deng,ECCV,2024,https://eccv.ecva.net/virtual/2024/poster/1364,https://www.ecva.net/papers/eccv_2024/papers_ECCV/papers/00319.pdf,2024 Poster
ECCV2024-0024,MapDistill: Boosting Efficient Camera-based HD Map Construction via Camera-LiDAR Fusion Model Distillation,Xiaoshuai Hao; Ruikai Li; Hui Zhang; Rong Yin; Dingzhe Li; Sangil Jung; Seung-In Park; ByungIn Yoo; Haimei Zhao; Jing Zhang,ECCV,2024,https://eccv.ecva.net/virtual/2024/poster/237,https://www.ecva.net/papers/eccv_2024/papers_ECCV/papers/00358.pdf,2024 Poster
ECCV2024-0025,High-Resolution and Few-shot View Synthesis from Asymmetric Dual-lens Inputs,Ruikang Xu; Mingde Yao; Yue Li; Yueyi Zhang; Zhiwei Xiong,ECCV,2024,https://eccv.ecva.net/virtual/2024/poster/2395,https://www.ecva.net/papers/eccv_2024/papers_ECCV/papers/00368.pdf,2024 Poster
ECCV2024-0026,AFreeCA: Annotation-Free Counting for All,Adriano DAlessandro; Ali Mahdavi-Amiri; Ghassan Hamarneh,ECCV,2024,https://eccv.ecva.net/virtual/2024/poster/1135,https://www.ecva.net/papers/eccv_2024/papers_ECCV/papers/00497.pdf,2024 Poster
ECCV2024-0027,Adversarially Robust Distillation by Reducing the Student-Teacher Variance Gap,Junhao Dong; Piotr Koniusz; Junxi Chen; Yew Soon Ong,ECCV,2024,https://eccv.ecva.net/virtual/2024/poster/845,https://www.ecva.net/papers/eccv_2024/papers_ECCV/papers/00499.pdf,2024 Poster
ECCV2024-0028,LN3Diff: Scalable Latent Neural Fields Diffusion for Speedy 3D Generation,Yushi Lan; Fangzhou Hong; Shuai Yang; Shangchen Zhou; Xuyi Meng; Bo Dai; Xingang Pan; Chen Change Loy,ECCV,2024,https://eccv.ecva.net/virtual/2024/poster/1669,https://www.ecva.net/papers/eccv_2024/papers_ECCV/papers/00501.pdf,2024 Poster
ECCV2024-0029,Motion and Structure from Event-based Normal Flow,Zhongyang Ren; Bangyan Liao; Delei Kong; Jinghang Li; Peidong Liu; Laurent Kneip; Guillermo Gallego; Yi Zhou,ECCV,2024,https://eccv.ecva.net/virtual/2024/poster/2480,https://www.ecva.net/papers/eccv_2024/papers_ECCV/papers/07261.pdf,2024 Poster
ECCV2024-0030,Hierarchical Temporal Context Learning for Camera-based Semantic Scene Completion,Bohan Li; Jiajun Deng; Wenyao Zhang; Zhujin Liang; Dalong Du; Xin Jin; Wenjun Zeng,ECCV,2024,https://eccv.ecva.net/virtual/2024/poster/1366,https://www.ecva.net/papers/eccv_2024/papers_ECCV/papers/00502.pdf,2024 Poster
ECCV2024-0031,DiscoMatch: Fast Discrete Optimisation for Geometrically Consistent 3D Shape Matching,Paul Roetzer; Ahmed Abbas; Dongliang Cao; Florian Bernard; Paul Swoboda,ECCV,2024,https://eccv.ecva.net/virtual/2024/poster/595,https://www.ecva.net/papers/eccv_2024/papers_ECCV/papers/07026.pdf,2024 Poster
ECCV2024-0032,When Pedestrian Detection Meets Multi-Modal Learning: Generalist Model and Benchmark Dataset,Yi Zhang; Wang Zeng; Sheng Jin; Chen Qian; Ping Luo; Wentao Liu,ECCV,2024,https://eccv.ecva.net/virtual/2024/poster/236,https://www.ecva.net/papers/eccv_2024/papers_ECCV/papers/06487.pdf,2024 Poster
ECCV2024-0033,HIMO: A New Benchmark for Full-Body Human Interacting with Multiple Objects,Xintao Lv; Liang Xu; Yichao Yan; Xin Jin; Congsheng Xu; Wu Shuwen; Yifan Liu; Lincheng Li; Mengxiao Bi; Wenjun Zeng; Xiaokang Yang,ECCV,2024,https://eccv.ecva.net/virtual/2024/poster/2123,https://www.ecva.net/papers/eccv_2024/papers_ECCV/papers/00564.pdf,2024 Poster
ECCV2024-0034,You Only Learn One Query: Learning Unified Human Query for Single-Stage Multi-Person Multi-Task Human-Centric Perception,Sheng Jin; Shuhuai Li; Tong Li; Wentao Liu; Chen Qian; Ping Luo,ECCV,2024,https://eccv.ecva.net/virtual/2024/poster/2556,https://www.ecva.net/papers/eccv_2024/papers_ECCV/papers/02688.pdf,2024 Poster
ECCV2024-0035,Contrastive ground-level image and remote sensing pre-training improves representation learning for natural world imagery,Andy V Huynh; Lauren Gillespie; Jael Lopez-Saucedo; Claire Tang; Rohan Sikand; Moisés Expósito-Alonso,ECCV,2024,https://eccv.ecva.net/virtual/2024/poster/353,https://www.ecva.net/papers/eccv_2024/papers_ECCV/papers/10352.pdf,2024 Poster
ECCV2024-0036,Instance-dependent Noisy-label Learning with Graphical Model Based Noise-rate Estimation,Arpit Garg; Cuong Cao Nguyen; RAFAEL FELIX; Thanh-Toan Do; Gustavo Carneiro,ECCV,2024,https://eccv.ecva.net/virtual/2024/poster/1568,https://www.ecva.net/papers/eccv_2024/papers_ECCV/papers/00589.pdf,2024 Poster
ECCV2024-0037,GKGNet: Group K-Nearest Neighbor based Graph Convolutional Network for Multi-Label Image Recognition,Ruijie Yao; Sheng Jin; Lumin Xu; Wang Zeng; Wentao Liu; Chen Qian; Ping Luo; Ji Wu,ECCV,2024,https://eccv.ecva.net/virtual/2024/poster/831,https://www.ecva.net/papers/eccv_2024/papers_ECCV/papers/02675.pdf,2024 Poster
ECCV2024-0038,LayoutDETR: Detection Transformer Is a Good Multimodal Layout Designer,Ning Yu; Chia-Chih Chen; Zeyuan Chen; Rui Meng; Gang Wu; Paul W Josel; Juan Carlos Niebles; Caiming Xiong; Ran Xu,ECCV,2024,https://eccv.ecva.net/virtual/2024/poster/939,https://www.ecva.net/papers/eccv_2024/papers_ECCV/papers/03022.pdf,2024 Poster
ECCV2024-0039,Merlin: Empowering Multimodal LLMs with Foresight Minds,En Yu; liang zhao; YANA WEI; Jinrong Yang; Dongming Wu; Lingyu Kong; Haoran Wei; Tiancai Wang; Zheng Ge; Xiangyu Zhang; Wenbing Tao,ECCV,2024,https://eccv.ecva.net/virtual/2024/poster/1827,https://www.ecva.net/papers/eccv_2024/papers_ECCV/papers/00613.pdf,2024 Poster
ECCV2024-0040,E.T. the Exceptional Trajectory: Text-to-camera-trajectory generation with character awareness,Robin Courant; Nicolas Dufour; Xi WANG; Marc Christie; Vicky Kalogeiton,ECCV,2024,https://eccv.ecva.net/virtual/2024/poster/1401,https://www.ecva.net/papers/eccv_2024/papers_ECCV/papers/00632.pdf,2024 Poster
ECCV2024-0041,Nuvo: Neural UV Mapping for Unruly 3D Representations,Pratul Srinivasan; Stephan J Garbin; Dor Verbin; Jon Barron; Ben Mildenhall,ECCV,2024,https://eccv.ecva.net/virtual/2024/poster/188,https://www.ecva.net/papers/eccv_2024/papers_ECCV/papers/05571.pdf,2024 Poster
ECCV2024-0042,Towards Neuro-Symbolic Video Understanding,Minkyu Choi; Harsh Goel; Mohammad Omama; Yunhao Yang; Sahil Shah; Sandeep Chinchali,ECCV,2024,https://eccv.ecva.net/virtual/2024/poster/1979,https://www.ecva.net/papers/eccv_2024/papers_ECCV/papers/10038.pdf,2024 Poster
ECCV2024-0043,SceneGraphLoc: Cross-Modal Coarse Visual Localization on 3D Scene Graphs,Yang Miao; Francis Engelmann; Olga Vysotska; Federico Tombari; Marc Pollefeys; Daniel Barath,ECCV,2024,https://eccv.ecva.net/virtual/2024/poster/1342,https://www.ecva.net/papers/eccv_2024/papers_ECCV/papers/01255.pdf,2024 Poster
ECCV2024-0044,Improving 2D Feature Representations by 3D-Aware Fine-Tuning,Yuanwen Yue; Anurag Das; Francis Engelmann; Siyu Tang; Jan Eric Lenssen,ECCV,2024,https://eccv.ecva.net/virtual/2024/poster/953,https://www.ecva.net/papers/eccv_2024/papers_ECCV/papers/00176.pdf,2024 Poster
ECCV2024-0045,Diffusion Bridges for 3D Point Cloud Denoising,Mathias Vogel; Keisuke Tateno; Marc Pollefeys; Federico Tombari; Marie-Julie Rakotosaona; Francis Engelmann,ECCV,2024,https://eccv.ecva.net/virtual/2024/poster/207,https://www.ecva.net/papers/eccv_2024/papers_ECCV/papers/00203.pdf,2024 Poster
ECCV2024-0046,AttnZero: Efficient Attention Discovery for Vision Transformers,Lujun Li; Zimian Wei; Peijie Dong; Wenhan Luo; Wei Xue; Qifeng Liu; Yike Guo,ECCV,2024,https://eccv.ecva.net/virtual/2024/poster/2294,https://www.ecva.net/papers/eccv_2024/papers_ECCV/papers/00666.pdf,2024 Poster
ECCV2024-0047,Auto-GAS: Automated Proxy Discovery for Training-free Generative Architecture Search,Lujun Li; Haosen SUN; Shiwen Li; Peijie Dong; Wenhan Luo; Wei Xue; Qifeng Liu; Yike Guo,ECCV,2024,https://eccv.ecva.net/virtual/2024/poster/1951,https://www.ecva.net/papers/eccv_2024/papers_ECCV/papers/00668.pdf,2024 Poster
ECCV2024-0048,Auto-DAS: Automated Proxy Discovery for Training-free Distillation-aware Architecture Search,Haosen SUN; Lujun Li; Peijie Dong; Zimian Wei; Shitong Shao,ECCV,2024,https://eccv.ecva.net/virtual/2024/poster/1584,https://www.ecva.net/papers/eccv_2024/papers_ECCV/papers/00676.pdf,2024 Poster
ECCV2024-0049,Spectral Subsurface Scattering for Material Classification,Haejoon Lee; Aswin C. Sankaranarayanan,ECCV,2024,https://eccv.ecva.net/virtual/2024/poster/739,https://www.ecva.net/papers/eccv_2024/papers_ECCV/papers/00725.pdf,2024 Poster
ECCV2024-0050,HeadGaS: Real-Time Animatable Head Avatars via 3D Gaussian Splatting,Helisa Dhamo; Yinyu Nie; Arthur Moreau; Song Jifei; Richard Shaw; Yiren Zhou; Eduardo Pérez Pellitero,ECCV,2024,https://eccv.ecva.net/virtual/2024/poster/893,https://www.ecva.net/papers/eccv_2024/papers_ECCV/papers/00280.pdf,2024 Poster
ECCV2024-0051,"Eyes Closed, Safety On: Protecting Multimodal LLMs via Image-to-Text Transformation",Yunhao Gou; Kai Chen; Zhili LIU; Lanqing Hong; Hang Xu; ZHENGUO LI; Dit-Yan Yeung; James Kwok; Yu Zhang,ECCV,2024,https://eccv.ecva.net/virtual/2024/poster/1496,https://www.ecva.net/papers/eccv_2024/papers_ECCV/papers/02634.pdf,2024 Poster
ECCV2024-0052,nuCraft: Crafting High Resolution 3D Semantic Occupancy for Unified 3D Scene Understanding,Benjin Zhu; zhe wang; Hongsheng LI,ECCV,2024,https://eccv.ecva.net/virtual/2024/poster/246,https://www.ecva.net/papers/eccv_2024/papers_ECCV/papers/00730.pdf,2024 Poster
ECCV2024-0053,HumanRefiner: Benchmarking Abnormal Human Generation and Refining with Coarse-to-fine Pose-Reversible Guidance,Guian Fang; Wenbiao Yan; Yuanfan Guo; Jianhua Han; Zutao Jiang; Hang Xu; Shengcai Liao; Xiaodan Liang,ECCV,2024,https://eccv.ecva.net/virtual/2024/poster/197,https://www.ecva.net/papers/eccv_2024/papers_ECCV/papers/04696.pdf,2024 Poster
ECCV2024-0054,CarFormer: Self-Driving with Learned Object-Centric Representations,Shadi Hamdan; Fatma Guney,ECCV,2024,https://eccv.ecva.net/virtual/2024/poster/2110,https://www.ecva.net/papers/eccv_2024/papers_ECCV/papers/00753.pdf,2024 Poster
ECCV2024-0055,Text-Guided Video Masked Autoencoder,David Fan; Jue Wang; Shuai Liao; Zhikang Zhang; Vimal Bhat; Xinyu Li,ECCV,2024,https://eccv.ecva.net/virtual/2024/poster/2573,https://www.ecva.net/papers/eccv_2024/papers_ECCV/papers/00790.pdf,2024 Poster
ECCV2024-0056,PanGu-Draw: Advancing Resource-Efficient Text-to-Image Synthesis with Time-Decoupled Training and Reusable Coop-Diffusion,Guansong Lu; Yuanfan Guo; Jianhua Han; Minzhe Niu; Yihan Zeng; Xu Songcen; Zeyi Huang; Zhao Zhong; Wei Zhang; Hang Xu,ECCV,2024,https://eccv.ecva.net/virtual/2024/poster/2507,https://www.ecva.net/papers/eccv_2024/papers_ECCV/papers/06138.pdf,2024 Poster
ECCV2024-0057,BAD-Gaussians: Bundle Adjusted Deblur Gaussian Splatting,Lingzhe Zhao; Peng Wang; Peidong Liu,ECCV,2024,https://eccv.ecva.net/virtual/2024/poster/2028,https://www.ecva.net/papers/eccv_2024/papers_ECCV/papers/03633.pdf,2024 Poster
ECCV2024-0058,Textual-Visual Logic Challenge: Understanding and Reasoning in Text-to-Image Generation,Peixi Xiong; Michael A Kozuch; Nilesh Jain,ECCV,2024,https://eccv.ecva.net/virtual/2024/poster/763,https://www.ecva.net/papers/eccv_2024/papers_ECCV/papers/00796.pdf,2024 Poster
ECCV2024-0059,ShareGPT4V: Improving Large Multi-Modal Models with Better Captions,Lin Chen; Jinsong Li; Xiaoyi Dong; Pan Zhang; Conghui He; Jiaqi Wang; Feng Zhao; Dahua Lin,ECCV,2024,https://eccv.ecva.net/virtual/2024/poster/765,https://www.ecva.net/papers/eccv_2024/papers_ECCV/papers/02629.pdf,2024 Poster
ECCV2024-0060,EvSign: Sign Language Recognition and Translation with Streaming Events,Pengyu Zhang; Hao Yin; Zeren Wang; Wenyue Chen; Sheng Ming Li; Dong Wang; Huchuan Lu; XU JIA,ECCV,2024,https://eccv.ecva.net/virtual/2024/poster/1839,https://www.ecva.net/papers/eccv_2024/papers_ECCV/papers/00799.pdf,2024 Poster
ECCV2024-0061,MetaAug: Meta-Data Augmentation for Post-Training Quantization,Cuong Pham; Hoang Anh Dung; Cuong Cao Nguyen; Trung Le; Dinh Q Phung; Gustavo Carneiro; Thanh-Toan Do,ECCV,2024,https://eccv.ecva.net/virtual/2024/poster/1554,https://www.ecva.net/papers/eccv_2024/papers_ECCV/papers/03914.pdf,2024 Poster
ECCV2024-0062,QUAR-VLA: Vision-Language-Action Model for Quadruped Robots,Pengxiang Ding; Han Zhao; Wenjie Zhang; Wenxuan Song; Min Zhang; Siteng Huang; Ningxi Yang; Donglin Wang,ECCV,2024,https://eccv.ecva.net/virtual/2024/poster/1103,https://www.ecva.net/papers/eccv_2024/papers_ECCV/papers/00808.pdf,2024 Poster
ECCV2024-0063,Towards Latent Masked Image Modeling for Self-Supervised Visual Representation Learning,Yibing Wei; Abhinav Gupta; Pedro Morgado,ECCV,2024,https://eccv.ecva.net/virtual/2024/poster/1174,https://www.ecva.net/papers/eccv_2024/papers_ECCV/papers/05568.pdf,2024 Poster
ECCV2024-0064,UNIKD: UNcertainty-Filtered Incremental Knowledge Distillation for Neural Implicit Representation,Mengqi GUO; Chen Li; Hanlin Chen; Gim Hee Lee,ECCV,2024,https://eccv.ecva.net/virtual/2024/poster/170,https://www.ecva.net/papers/eccv_2024/papers_ECCV/papers/06561.pdf,2024 Poster
ECCV2024-0065,PartSTAD: 2D-to-3D Part Segmentation Task Adaptation,Hyunjin Kim; Minhyuk Sung,ECCV,2024,https://eccv.ecva.net/virtual/2024/poster/410,https://www.ecva.net/papers/eccv_2024/papers_ECCV/papers/00817.pdf,2024 Poster
ECCV2024-0066,FutureDepth: Learning to Predict the Future Improves Video Depth Estimation,Rajeev Yasarla; Manish Kumar Singh; Hong Cai; Yunxiao Shi; Jisoo Jeong; Yinhao Zhu; Shizhong Han; Risheek Garrepalli; Fatih Porikli,ECCV,2024,https://eccv.ecva.net/virtual/2024/poster/1717,https://www.ecva.net/papers/eccv_2024/papers_ECCV/papers/00828.pdf,2024 Poster
ECCV2024-0067,Cross-Input Certified Training for Universal Perturbations,Changming Xu; Gagandeep Singh,ECCV,2024,https://eccv.ecva.net/virtual/2024/poster/1586,https://www.ecva.net/papers/eccv_2024/papers_ECCV/papers/08210.pdf,2024 Poster
ECCV2024-0068,Rethinking and Improving Visual Prompt Selection for In-Context Learning Segmentation Framework,Wei Suo; Lanqing Lai; Mengyang Sun; Hanwang Zhang; Peng Wang; Yanning Zhang,ECCV,2024,https://eccv.ecva.net/virtual/2024/poster/785,https://www.ecva.net/papers/eccv_2024/papers_ECCV/papers/06227.pdf,2024 Poster
ECCV2024-0069,LiDAR-Event Stereo Fusion with Hallucinations,Luca Bartolomei; Matteo Poggi; Andrea Conti; Stefano Mattoccia,ECCV,2024,https://eccv.ecva.net/virtual/2024/poster/999,https://www.ecva.net/papers/eccv_2024/papers_ECCV/papers/00932.pdf,2024 Poster
ECCV2024-0070,X-Former: Unifying Contrastive and Reconstruction Learning for MLLMs,Swetha Sirnam; Jinyu Yang; Tal Neiman; Mamshad Nayeem Rizve; Son Tran; Benjamin Yao; Trishul A Chilimbi; Shah Mubarak,ECCV,2024,https://eccv.ecva.net/virtual/2024/poster/1118,https://www.ecva.net/papers/eccv_2024/papers_ECCV/papers/00935.pdf,2024 Poster
ECCV2024-0071,Multi-Granularity Sparse Relationship Matrix Prediction Network for End-to-End Scene Graph Generation,lei wang; Zejian Yuan; Badong Chen,ECCV,2024,https://eccv.ecva.net/virtual/2024/poster/1513,https://www.ecva.net/papers/eccv_2024/papers_ECCV/papers/10738.pdf,2024 Poster
ECCV2024-0072,Revisiting Supervision for Continual Representation Learning,Daniel Marczak; Sebastian Cygert; Tomasz Trzcinski; Bartlomiej Twardowski,ECCV,2024,https://eccv.ecva.net/virtual/2024/poster/1203,https://www.ecva.net/papers/eccv_2024/papers_ECCV/papers/00944.pdf,2024 Poster
ECCV2024-0073,Dolphins: Multimodal Language Model for Driving,Yingzi Ma; Yulong Cao; Jiachen Sun; Marco Pavone; Chaowei Xiao,ECCV,2024,https://eccv.ecva.net/virtual/2024/poster/356,https://www.ecva.net/papers/eccv_2024/papers_ECCV/papers/06203.pdf,2024 Poster
ECCV2024-0074,MMBENCH: Is Your Multi-Modal Model an All-around Player?,Yuan Liu; Haodong Duan; Yuanhan Zhang; Bo Li; Songyang Zhang; Wangbo Zhao; Yike Yuan; Jiaqi Wang; Conghui He; Ziwei Liu; Kai Chen; Dahua Lin,ECCV,2024,https://eccv.ecva.net/virtual/2024/poster/2003,https://www.ecva.net/papers/eccv_2024/papers_ECCV/papers/00959.pdf,2024 Poster
ECCV2024-0075,HUMOS: Human Motion Model Conditioned on Body Shape,Shashank Tripathi; Omid Taheri; Christoph Lassner; Michael J. Black; Daniel Holden; Carsten Stoll,ECCV,2024,https://eccv.ecva.net/virtual/2024/poster/262,https://www.ecva.net/papers/eccv_2024/papers_ECCV/papers/02441.pdf,2024 Poster
ECCV2024-0076,ZipLoRA: Any Subject in Any Style by Effectively Merging LoRAs,Viraj Shah; Nataniel Ruiz; Forrester Cole; Erika Lu; Svetlana Lazebnik; Yuanzhen Li; Varun Jampani,ECCV,2024,https://eccv.ecva.net/virtual/2024/poster/1760,https://www.ecva.net/papers/eccv_2024/papers_ECCV/papers/00148.pdf,2024 Poster
ECCV2024-0077,Implicit Filtering for Learning Neural Signed Distance Functions from 3D Point Clouds,Shengtao Li; Ge Gao; Yudong Liu; Ming Gu; Yushen Liu,ECCV,2024,https://eccv.ecva.net/virtual/2024/poster/2066,https://www.ecva.net/papers/eccv_2024/papers_ECCV/papers/00960.pdf,2024 Poster
ECCV2024-0078,Unsupervised Exposure Correction,Ruodai Cui; Li Niu; Guosheng Hu,ECCV,2024,https://eccv.ecva.net/virtual/2024/poster/624,https://www.ecva.net/papers/eccv_2024/papers_ECCV/papers/00986.pdf,2024 Poster
ECCV2024-0079,SceneScript: Reconstructing Scenes With An Autoregressive Structured Language Model,Armen Avetisyan; Christopher Xie; Henry Howard-Jenkins; Tsun-Yi Yang; Samir Aroudj; Suvam Patra; Fuyang Zhang; Luke Holland; Duncan Frost; Campbell Orme; Jakob Engel; Edward Miller; Richard Newcombe; Vasileios Balntas,ECCV,2024,https://eccv.ecva.net/virtual/2024/poster/200,https://www.ecva.net/papers/eccv_2024/papers_ECCV/papers/07833.pdf,2024 Poster
ECCV2024-0080,External Knowledge Enhanced 3D Scene Generation from Sketch,Zijie Wu; Mingtao Feng; Yaonan Wang; He Xie; Weisheng Dong; Bo Miao; Ajmal Mian,ECCV,2024,https://eccv.ecva.net/virtual/2024/poster/1670,https://www.ecva.net/papers/eccv_2024/papers_ECCV/papers/00991.pdf,2024 Poster
ECCV2024-0081,GlobalPointer: Large-Scale Plane Adjustment with Bi-Convex Relaxation,Bangyan Liao; Zhenjun Zhao; Lu Chen; Haoang Li; Daniel Cremers; Peidong Liu,ECCV,2024,https://eccv.ecva.net/virtual/2024/poster/215,https://www.ecva.net/papers/eccv_2024/papers_ECCV/papers/07675.pdf,2024 Poster
ECCV2024-0082,DreamScene360: Unconstrained Text-to-3D Scene Generation with Panoramic Gaussian Splatting,Shijie Zhou; Zhiwen Fan; Dejia Xu; Haoran Chang; Pradyumna Chari; Tejas K Bharadwaj; Suya You; Zhangyang Wang; Achuta Kadambi,ECCV,2024,https://eccv.ecva.net/virtual/2024/poster/2046,https://www.ecva.net/papers/eccv_2024/papers_ECCV/papers/00996.pdf,2024 Poster
ECCV2024-0083,Frequency-Spatial Entanglement Learning for Camouflaged Object Detection,Yanguang Sun; Chunyan Xu; Jian Yang; Hanyu Xuan; Lei Luo,ECCV,2024,https://eccv.ecva.net/virtual/2024/poster/1899,https://www.ecva.net/papers/eccv_2024/papers_ECCV/papers/01001.pdf,2024 Poster
ECCV2024-0084,3D Congealing: 3D-Aware Image Alignment in the Wild,Yunzhi Zhang; Zizhang Li; Amit Raj; Andreas Engelhardt; Yuanzhen Li; Tingbo Hou; Jiajun Wu; Varun Jampani,ECCV,2024,https://eccv.ecva.net/virtual/2024/poster/955,https://www.ecva.net/papers/eccv_2024/papers_ECCV/papers/00145.pdf,2024 Poster
