id,title,authors,conference,year,official_page,pdf_link,status_or_award
ECCV2024-1199,GalLop: Learning global and local prompts for vision-language models,Marc Lafon; Elias Ramzi; Clément Rambour; Nicolas Audebert; Nicolas THOME,ECCV,2024,https://eccv.ecva.net/virtual/2024/poster/1871,https://www.ecva.net/papers/eccv_2024/papers_ECCV/papers/07834.pdf,2024 Poster
ECCV2024-1200,Depth on Demand: Streaming Dense Depth from a Low Frame Rate Active Sensor,Andrea Conti; Matteo Poggi; Valerio CAMBARERI; Stefano Mattoccia,ECCV,2024,https://eccv.ecva.net/virtual/2024/poster/628,https://www.ecva.net/papers/eccv_2024/papers_ECCV/papers/07836.pdf,2024 Poster
ECCV2024-1201,Two-Stage Video Shadow Detection via Temporal-Spatial Adaption,Xin Duan; Yu Cao; Lei Zhu; Gang Fu; Xin WANG; Renjie ZHANG; Ping Li,ECCV,2024,https://eccv.ecva.net/virtual/2024/poster/705,https://www.ecva.net/papers/eccv_2024/papers_ECCV/papers/06444.pdf,2024 Poster
ECCV2024-1202,N2F2: Hierarchical Scene Understanding with Nested Neural Feature Fields,Yash Bhalgat; Iro Laina; Joao F Henriques; Andrew ZISSERMAN; Andrea Vedaldi,ECCV,2024,https://eccv.ecva.net/virtual/2024/poster/1144,https://www.ecva.net/papers/eccv_2024/papers_ECCV/papers/07652.pdf,2024 Poster
ECCV2024-1203,Semi-Supervised Video Desnowing Network via Temporal Decoupling Experts and Distribution-Driven Contrastive Regularization,Hongtao Wu; Yijun Yang; Angelica I Aviles-Rivero; Jingjing Ren; Sixiang Chen; Haoyu Chen; Lei Zhu,ECCV,2024,https://eccv.ecva.net/virtual/2024/poster/2531,https://www.ecva.net/papers/eccv_2024/papers_ECCV/papers/01500.pdf,2024 Poster
ECCV2024-1204,Bidirectional Uncertainty-Based Active Learning for Open-Set Annotation,ChenChen Zong; Ye-Wen Wang; Kun-Peng Ning; Hai-Bo Ye; Sheng-Jun Huang,ECCV,2024,https://eccv.ecva.net/virtual/2024/poster/458,https://www.ecva.net/papers/eccv_2024/papers_ECCV/papers/04026.pdf,2024 Poster
ECCV2024-1205,Lossy Image Compression with Foundation Diffusion Models,Lucas Relic; Roberto Azevedo; Markus Gross; Christopher Schroers,ECCV,2024,https://eccv.ecva.net/virtual/2024/poster/2527,https://www.ecva.net/papers/eccv_2024/papers_ECCV/papers/07844.pdf,2024 Poster
ECCV2024-1206,UniM2AE: Multi-modal Masked Autoencoders with Unified 3D Representation for 3D Perception in Autonomous Driving,Jian Zou; Tianyu Huang; Guanglei Yang; Zhenhua Guo; Tao Luo; Chun-Mei Feng; Wangmeng Zuo,ECCV,2024,https://eccv.ecva.net/virtual/2024/poster/635,https://www.ecva.net/papers/eccv_2024/papers_ECCV/papers/03274.pdf,2024 Poster
ECCV2024-1207,CLIP-DINOiser: Teaching CLIP a few DINO tricks for open-vocabulary semantic segmentation,Monika Wysoczanska; Oriane Siméoni; Michaël Ramamonjisoa; Andrei Bursuc; Tomasz Trzciński; Patrick Pérez,ECCV,2024,https://eccv.ecva.net/virtual/2024/poster/1520,https://www.ecva.net/papers/eccv_2024/papers_ECCV/papers/07850.pdf,2024 Poster
ECCV2024-1208,FMBoost: Boosting Latent Diffusion with Flow Matching,Johannes Schusterbauer-Fischer; Ming Gui; Pingchuan Ma; Nick Stracke; Stefan Andreas Baumann; Tao Hu; Bjorn Ommer,ECCV,2024,https://eccv.ecva.net/virtual/2024/poster/2159,https://www.ecva.net/papers/eccv_2024/papers_ECCV/papers/07855.pdf,2024 Poster
ECCV2024-1209,Learning High-resolution Vector Representation from Multi-Camera Images for 3D Object Detection,Zhili Chen; Shuangjie Xu; Maosheng Ye; Zian Qian; Xiaoyi Zou; Dit-Yan Yeung; Qifeng Chen,ECCV,2024,https://eccv.ecva.net/virtual/2024/poster/2098,https://www.ecva.net/papers/eccv_2024/papers_ECCV/papers/05200.pdf,2024 Poster
ECCV2024-1210,M^2Depth: Self-supervised Two-Frame Multi-camera Metric Depth Estimation,Yingshuang Zou; Yikang Ding; Xi Qiu; Haoqian Wang; Haotian Zhang,ECCV,2024,https://eccv.ecva.net/virtual/2024/poster/134,https://www.ecva.net/papers/eccv_2024/papers_ECCV/papers/06281.pdf,2024 Poster
ECCV2024-1211,Shifted Autoencoders for Point Annotation Restoration in Object Counting,Yuda Zou; Xin Xiao; Peilin Zhou; Zhichao Sun; Bo Du; Yongchao Xu,ECCV,2024,https://eccv.ecva.net/virtual/2024/poster/2274,https://www.ecva.net/papers/eccv_2024/papers_ECCV/papers/03594.pdf,2024 Poster
ECCV2024-1212,An Optimization Framework to Enforce Multi-View Consistency for Texturing 3D Meshes,Zhengyi Zhao; Chen Song; Xiaodong Gu; Yuan Dong; Qi Zuo; Weihao Yuan; Zilong Dong; Liefeng Bo; Qixing Huang,ECCV,2024,https://eccv.ecva.net/virtual/2024/poster/927,https://www.ecva.net/papers/eccv_2024/papers_ECCV/papers/05282.pdf,2024 Poster
ECCV2024-1213,Kernel Diffusion: An Alternate Approach to Blind Deconvolution,Yash Sanghvi; Yiheng Chi; Stanley Chan,ECCV,2024,https://eccv.ecva.net/virtual/2024/poster/1050,https://www.ecva.net/papers/eccv_2024/papers_ECCV/papers/07611.pdf,2024 Poster
ECCV2024-1214,FoundPose: Unseen Object Pose Estimation with Foundation Features,Evin Pınar Örnek; Yann Labbé; Bugra Tekin; Lingni Ma; Cem Keskin; Christian Forster; Tomas Hodan,ECCV,2024,https://eccv.ecva.net/virtual/2024/poster/1704,https://www.ecva.net/papers/eccv_2024/papers_ECCV/papers/03742.pdf,2024 Poster
ECCV2024-1215,LNL+K: Enhancing Learning with Noisy Labels Through Noise Source Knowledge Integration,Siqi Wang; Bryan Plummer,ECCV,2024,https://eccv.ecva.net/virtual/2024/poster/2309,https://www.ecva.net/papers/eccv_2024/papers_ECCV/papers/07862.pdf,2024 Poster
ECCV2024-1216,Diffusion Models as Data Mining Tools,Ioannis Siglidis; Aleksander Holynski; Alexei Efros; Mathieu Aubry; Shiry Ginosar,ECCV,2024,https://eccv.ecva.net/virtual/2024/poster/201,https://www.ecva.net/papers/eccv_2024/papers_ECCV/papers/07865.pdf,2024 Poster
ECCV2024-1217,Graph Neural Network Causal Explanation via Neural Causal Models,Arman Behnam; Binghui Wang,ECCV,2024,https://eccv.ecva.net/virtual/2024/poster/472,https://www.ecva.net/papers/eccv_2024/papers_ECCV/papers/07866.pdf,2024 Poster
ECCV2024-1218,SAMFusion: Sensor-Adaptive Multimodal Fusion for 3D Object Detection in Adverse Weather,Edoardo Palladin; Roland Dietze; Praveen Narayanan; Mario Bijelic; Felix Heide,ECCV,2024,https://eccv.ecva.net/virtual/2024/poster/1726,https://www.ecva.net/papers/eccv_2024/papers_ECCV/papers/07882.pdf,2024 Poster
ECCV2024-1219,"SPHINX: A Mixer of Weights, Visual Embeddings and Image Scales for Multi-modal Large Language Models",Ziyi Lin; Dongyang Liu; Renrui Zhang; Peng Gao; Longtian Qiu; Han Xiao; Han Qiu; Wenqi Shao; Keqin Chen; Jiaming Han; Siyuan Huang; Yichi Zhang; Xuming He; Yu Qiao; Hongsheng LI,ECCV,2024,https://eccv.ecva.net/virtual/2024/poster/761,https://www.ecva.net/papers/eccv_2024/papers_ECCV/papers/07894.pdf,2024 Poster
ECCV2024-1220,PathMMU: A Massive Multimodal Expert-Level Benchmark for Understanding and Reasoning in Pathology,YUXUAN SUN; Hao Wu; Chenglu Zhu; Sunyi Zheng; Qizi Chen; Kai Zhang; Yunlong Zhang; Dan Wan; Xiaoxiao Lan; Mengyue Zheng; Jingxiong Li; Xinheng Lyu; Tao Lin; Lin Yang,ECCV,2024,https://eccv.ecva.net/virtual/2024/poster/877,https://www.ecva.net/papers/eccv_2024/papers_ECCV/papers/07899.pdf,2024 Poster
ECCV2024-1221,Improving Adversarial Transferability via Model Alignment,Avery Ma; Amir-massoud Farahmand; Yangchen Pan; Philip Torr; Jindong Gu,ECCV,2024,https://eccv.ecva.net/virtual/2024/poster/1952,https://www.ecva.net/papers/eccv_2024/papers_ECCV/papers/07902.pdf,2024 Poster
ECCV2024-1222,RealGen: Retrieval Augmented Generation for Controllable Traffic Scenarios,Wenhao Ding; Yulong Cao; DING ZHAO; Chaowei Xiao; Marco Pavone,ECCV,2024,https://eccv.ecva.net/virtual/2024/poster/128,https://www.ecva.net/papers/eccv_2024/papers_ECCV/papers/07903.pdf,2024 Poster
ECCV2024-1223,ADen: Adaptive Density Representations for Sparse-view Camera Pose Estimation,Hao Tang; Weiyao Wang; Pierre Gleize; Matt Feiszli,ECCV,2024,https://eccv.ecva.net/virtual/2024/poster/505,https://www.ecva.net/papers/eccv_2024/papers_ECCV/papers/07904.pdf,2024 Poster
ECCV2024-1224,Embodied Understanding of Driving Scenarios,Yunsong Zhou; Linyan Huang; Qingwen Bu; Jia Zeng; Tianyu Li; Hang Qiu; Hongzi Zhu; Minyi Guo; Yu Qiao; Hongyang Li,ECCV,2024,https://eccv.ecva.net/virtual/2024/poster/1485,https://www.ecva.net/papers/eccv_2024/papers_ECCV/papers/07908.pdf,2024 Poster
ECCV2024-1225,NeuroPictor: Refining fMRI-to-Image Reconstruction via Multi-individual Pretraining and Multi-level Modulation,Jingyang Huo; Yikai Wang; Yanwei Fu; Xuelin Qian; Chong Li; Yun Wang; Jianfeng Feng,ECCV,2024,https://eccv.ecva.net/virtual/2024/poster/326,https://www.ecva.net/papers/eccv_2024/papers_ECCV/papers/06746.pdf,2024 Poster
ECCV2024-1226,ViLA: Efficient Video-Language Alignment for Video Question Answering,Xijun Wang; Junbang Liang; Chun-Kai Wang; Kenan Deng; Yu Lou; Ming C Lin; Shan Yang,ECCV,2024,https://eccv.ecva.net/virtual/2024/poster/2212,https://www.ecva.net/papers/eccv_2024/papers_ECCV/papers/07919.pdf,2024 Poster
ECCV2024-1227,OpenIns3D: Snap and Lookup for 3D Open-vocabulary Instance Segmentation,Zhening Huang; Xiaoyang Wu; Xi Chen; Hengshuang ZHAO; Lei Zhu; Joan Lasenby,ECCV,2024,https://eccv.ecva.net/virtual/2024/poster/401,https://www.ecva.net/papers/eccv_2024/papers_ECCV/papers/07914.pdf,2024 Poster
ECCV2024-1228,Factorizing Text-to-Video Generation by Explicit Image Conditioning,Rohit Girdhar; Mannat Singh; Andrew Brown; Quentin Duval; Samaneh Azadi; Sai Saketh Rambhatla; Mian Akbar Shah; Xi Yin; Devi Parikh; Ishan Misra,ECCV,2024,https://eccv.ecva.net/virtual/2024/poster/2496,https://www.ecva.net/papers/eccv_2024/papers_ECCV/papers/07921.pdf,2024 Poster
ECCV2024-1229,MobileDiffusion: Instant Text-to-Image Generation on Mobile Devices,Yang Zhao; Zhisheng Xiao; Yanwu Xu; Haolin Jia; Tingbo Hou,ECCV,2024,https://eccv.ecva.net/virtual/2024/poster/679,https://www.ecva.net/papers/eccv_2024/papers_ECCV/papers/07923.pdf,2024 Poster
ECCV2024-1230,Open-Set Biometrics: Beyond Good Closed-Set Models,Yiyang Su; Minchul Kim; Feng Liu; Anil Jain; Xiaoming Liu,ECCV,2024,https://eccv.ecva.net/virtual/2024/poster/1455,https://www.ecva.net/papers/eccv_2024/papers_ECCV/papers/07925.pdf,2024 Poster
ECCV2024-1231,Osmosis: RGBD Diffusion Prior for Underwater Image Restoration,Opher Bar Nathan; Deborah Steinberger-Levy; Tali Treibitz; Dan Rosenbaum,ECCV,2024,https://eccv.ecva.net/virtual/2024/poster/602,https://www.ecva.net/papers/eccv_2024/papers_ECCV/papers/07932.pdf,2024 Poster
ECCV2024-1232,Towards Adaptive Pseudo-label Learning for Semi-Supervised Temporal Action Localization,Feixiang Zhou; Bryan M. Williams; Hossein Rahmani,ECCV,2024,https://eccv.ecva.net/virtual/2024/poster/2563,https://www.ecva.net/papers/eccv_2024/papers_ECCV/papers/07935.pdf,2024 Poster
ECCV2024-1233,Computing the Lipschitz constant needed for fast scene recovery from CASSI measurements,Niels Chr. Overgaard; Anders Holst,ECCV,2024,https://eccv.ecva.net/virtual/2024/poster/213,https://www.ecva.net/papers/eccv_2024/papers_ECCV/papers/07936.pdf,2024 Poster
ECCV2024-1234,DatasetNeRF: Efficient 3D-aware Data Factory with Generative Radiance Fields,Yu Chi; Fangneng Zhan; Sibo Wu; Christian Theobalt; Adam Kortylewski,ECCV,2024,https://eccv.ecva.net/virtual/2024/poster/212,https://www.ecva.net/papers/eccv_2024/papers_ECCV/papers/07937.pdf,2024 Poster
ECCV2024-1235,Flowed Time of Flight Radiance Fields,Mikhail Okunev; Marc Mapeke; Benjamin Attal; Christian Richardt; Matthew O&amp;#x27;Toole; James Tompkin,ECCV,2024,https://eccv.ecva.net/virtual/2024/poster/2439,https://www.ecva.net/papers/eccv_2024/papers_ECCV/papers/07941.pdf,2024 Poster
ECCV2024-1236,Cut out the Middleman: Revisiting Pose-based Gait Recognition,YANG FU; Saihui Hou; Shibei Meng; Xuecai Hu; Chunshui Cao; Xu Liu; Yongzhen Huang,ECCV,2024,https://eccv.ecva.net/virtual/2024/poster/617,https://www.ecva.net/papers/eccv_2024/papers_ECCV/papers/04501.pdf,2024 Poster
ECCV2024-1237,3D-GOI: 3D GAN Omni-Inversion for Multifaceted and Multi-object Editing,Haoran Li; Long Ma; Haolin Shi; Yanbin Hao; Yong Liao; Lechao Cheng; Peng Yuan Zhou,ECCV,2024,https://eccv.ecva.net/virtual/2024/poster/579,https://www.ecva.net/papers/eccv_2024/papers_ECCV/papers/07943.pdf,2024 Poster
ECCV2024-1238,Fast Registration of Photorealistic Avatars for VR Facial Animation,Chaitanya Patel; Shaojie Bai; Te-Li Wang; Jason Saragih; Shih-En Wei,ECCV,2024,https://eccv.ecva.net/virtual/2024/poster/1638,https://www.ecva.net/papers/eccv_2024/papers_ECCV/papers/07945.pdf,2024 Poster
ECCV2024-1239,CoPT: Unsupervised Domain Adaptive Segmentation using Domain-Agnostic Text Embeddings,Cristina Mata; Kanchana N Ranasinghe; Michael S Ryoo,ECCV,2024,https://eccv.ecva.net/virtual/2024/poster/2261,https://www.ecva.net/papers/eccv_2024/papers_ECCV/papers/07950.pdf,2024 Poster
ECCV2024-1240,HiFi-Score: Fine-grained Image Description Evaluation with Hierarchical Parsing Graphs,Ziwei Yao; Ruiping Wang; Xilin CHEN,ECCV,2024,https://eccv.ecva.net/virtual/2024/poster/1123,https://www.ecva.net/papers/eccv_2024/papers_ECCV/papers/07957.pdf,2024 Poster
ECCV2024-1241,FedHARM: Harmonizing Model Architectural Diversity in Federated Learning,Anestis Kastellos; Athanasios Psaltis; Charalampos Z Patrikakis; Petros Daras,ECCV,2024,https://eccv.ecva.net/virtual/2024/poster/2691,https://www.ecva.net/papers/eccv_2024/papers_ECCV/papers/07971.pdf,2024 Poster
ECCV2024-1242,Thinking Outside the BBox: Unconstrained Generative Object Compositing,Gemma Canet Tarrés; Zhe Lin; Zhifei Zhang; Jianming Zhang; Yizhi Song; Dan Ruta; Andrew Gilbert; John Collomosse; Soo Ye Kim,ECCV,2024,https://eccv.ecva.net/virtual/2024/poster/2523,https://www.ecva.net/papers/eccv_2024/papers_ECCV/papers/07965.pdf,2024 Poster
ECCV2024-1243,EAGLES: Efficient Accelerated 3D Gaussians with Lightweight EncodingS,Sharath Girish; Kamal Gupta; Abhinav Shrivastava,ECCV,2024,https://eccv.ecva.net/virtual/2024/poster/2038,https://www.ecva.net/papers/eccv_2024/papers_ECCV/papers/07976.pdf,2024 Poster
ECCV2024-1244,Improving Geo-diversity of Generated Images with Contextualized Vendi Score Guidance,Reyhane Askari Hemmat; Melissa Hall; Alicia Yi Sun; Candace Ross; Michal Drozdzal; Adriana Romero-Soriano,ECCV,2024,https://eccv.ecva.net/virtual/2024/poster/286,https://www.ecva.net/papers/eccv_2024/papers_ECCV/papers/11844.pdf,2024 Poster
ECCV2024-1245,TCLC-GS: Tightly Coupled LiDAR-Camera Gaussian Splatting for Autonomous Driving,Cheng Zhao; su sun; Ruoyu Wang; Yuliang Guo; Jun-Jun Wan; Zhou Huang; Xinyu Huang; Yingjie Victor Chen; Liu Ren,ECCV,2024,https://eccv.ecva.net/virtual/2024/poster/1371,https://www.ecva.net/papers/eccv_2024/papers_ECCV/papers/07983.pdf,2024 Poster
ECCV2024-1246,RT-Pose: A 4D Radar-Tensor based 3D Human Pose Estimation and Localization Benchmark,Yuan-Hao Ho; Jen-Hao Cheng; Sheng Yao Kuan; Zhongyu Jiang; Wenhao Chai; Hsiang-Wei Huang; Chih-Lung Lin; Jenq-Neng Hwang,ECCV,2024,https://eccv.ecva.net/virtual/2024/poster/2086,https://www.ecva.net/papers/eccv_2024/papers_ECCV/papers/07989.pdf,2024 Poster
ECCV2024-1247,EditShield: Protecting Unauthorized Image Editing by Instruction-guided Diffusion Models,Ruoxi Chen; Haibo Jin; Yixin Liu; Jinyin Chen; Haohan Wang; Lichao Sun,ECCV,2024,https://eccv.ecva.net/virtual/2024/poster/1423,https://www.ecva.net/papers/eccv_2024/papers_ECCV/papers/07991.pdf,2024 Poster
ECCV2024-1248,"RICA^2: Rubric-Informed, Calibrated Assessment of Actions",Abrar Majeedi; Viswanatha Reddy Gajjala; Satya Sai Srinath Namburi GNVV; Yin Li,ECCV,2024,https://eccv.ecva.net/virtual/2024/poster/727,https://www.ecva.net/papers/eccv_2024/papers_ECCV/papers/08001.pdf,2024 Poster
ECCV2024-1249,Commonly Interesting Images,Fitim Abdullahu; Helmut Grabner,ECCV,2024,https://eccv.ecva.net/virtual/2024/poster/670,https://www.ecva.net/papers/eccv_2024/papers_ECCV/papers/08008.pdf,2024 Poster
ECCV2024-1250,Contrasting Deepfakes Diffusion via Contrastive Learning and Global-Local Similarities,Lorenzo Baraldi; Federico Cocchi; Marcella Cornia; Lorenzo Baraldi; Alessandro Nicolosi; Rita Cucchiara,ECCV,2024,https://eccv.ecva.net/virtual/2024/poster/715,https://www.ecva.net/papers/eccv_2024/papers_ECCV/papers/08009.pdf,2024 Poster
ECCV2024-1251,CriSp: Leveraging Tread Depth Maps for Enhanced Crime-Scene Shoeprint Matching,Samia Shafique; Shu Kong; Charless Fowlkes,ECCV,2024,https://eccv.ecva.net/virtual/2024/poster/2548,https://www.ecva.net/papers/eccv_2024/papers_ECCV/papers/08023.pdf,2024 Poster
ECCV2024-1252,Caltech Aerial RGB-Thermal Dataset in the Wild,Connor Lee; Matthew Anderson; Nikhil Ranganathan; Xingxing Zuo; Kevin T; Georgia Gkioxari; Soon-Jo Chung,ECCV,2024,https://eccv.ecva.net/virtual/2024/poster/987,https://www.ecva.net/papers/eccv_2024/papers_ECCV/papers/08026.pdf,2024 Poster
ECCV2024-1253,Diffusion Soup: Model Merging for Text-to-Image Diffusion Models,Benjamin J Biggs; Arjun Seshadri; Yang Zou; Achin Jain; Aditya Golatkar; Yusheng Xie; Alessandro Achille; Ashwin Swaminathan; Stefano Soatto,ECCV,2024,https://eccv.ecva.net/virtual/2024/poster/288,https://www.ecva.net/papers/eccv_2024/papers_ECCV/papers/08027.pdf,2024 Poster
ECCV2024-1254,CityGuessr: City-Level Video Geo-Localization on a Global Scale,Parth Parag Kulkarni; Gaurav Kumar Nayak; Shah Mubarak,ECCV,2024,https://eccv.ecva.net/virtual/2024/poster/351,https://www.ecva.net/papers/eccv_2024/papers_ECCV/papers/08031.pdf,2024 Poster
ECCV2024-1255,Bayesian Detector Combination for Object Detection with Crowdsourced Annotations,Zhi Qin Tan; Olga Isupova; Gustavo Carneiro; Xiatian Zhu; Yunpeng Li,ECCV,2024,https://eccv.ecva.net/virtual/2024/poster/420,https://www.ecva.net/papers/eccv_2024/papers_ECCV/papers/08038.pdf,2024 Poster
ECCV2024-1256,Revising Densification in Gaussian Splatting,Samuel Rota Bulò; Lorenzo Porzi; Peter Kontschieder,ECCV,2024,https://eccv.ecva.net/virtual/2024/poster/916,https://www.ecva.net/papers/eccv_2024/papers_ECCV/papers/08041.pdf,2024 Poster
ECCV2024-1257,FlexiEdit: Frequency-Aware Latent Refinement for Enhanced Non-Rigid Editing,Gwanhyeong Koo; Sunjae Yoon; Ji Woo Hong; Chang Yoo,ECCV,2024,https://eccv.ecva.net/virtual/2024/poster/666,https://www.ecva.net/papers/eccv_2024/papers_ECCV/papers/08042.pdf,2024 Poster
ECCV2024-1258,Text Motion Translator: A Bi-Directional Model for Enhanced 3D Human Motion Generation from Open-Vocabulary Descriptions,Yijun Qian; Jack Urbanek; Alexander Hauptmann; Jungdam Won,ECCV,2024,https://eccv.ecva.net/virtual/2024/poster/266,https://www.ecva.net/papers/eccv_2024/papers_ECCV/papers/08050.pdf,2024 Poster
ECCV2024-1259,UL-VIO: Ultra-lightweight Visual-Inertial Odometry with Noise Robust Test-time Adaptation,Jinho Park; Se Young Chun; Mingoo Seok,ECCV,2024,https://eccv.ecva.net/virtual/2024/poster/1719,https://www.ecva.net/papers/eccv_2024/papers_ECCV/papers/08054.pdf,2024 Poster
ECCV2024-1260,PolyOculus: Simultaneous Multi-view Image-based Novel View Synthesis,Jason Yu; Tristan Aumentado-Armstrong; Fereshteh Forghani; Konstantinos Derpanis; Marcus A Brubaker,ECCV,2024,https://eccv.ecva.net/virtual/2024/poster/181,https://www.ecva.net/papers/eccv_2024/papers_ECCV/papers/08055.pdf,2024 Poster
ECCV2024-1261,A Graph-Based Approach for Category-Agnostic Pose Estimation,Or Hirschorn; Shai Avidan,ECCV,2024,https://eccv.ecva.net/virtual/2024/poster/1706,https://www.ecva.net/papers/eccv_2024/papers_ECCV/papers/08058.pdf,2024 Poster
ECCV2024-1262,Depth-guided NeRF Training via Earth Mover’s Distance,Anita Rau; Josiah Aklilu; Floyd C Holsinger; Serena Yeung-Levy,ECCV,2024,https://eccv.ecva.net/virtual/2024/poster/903,https://www.ecva.net/papers/eccv_2024/papers_ECCV/papers/08062.pdf,2024 Poster
ECCV2024-1263,INTRA: Interaction Relationship-aware Weakly Supervised Affordance Grounding,jiha jang; Hoigi Seo; Se Young Chun,ECCV,2024,https://eccv.ecva.net/virtual/2024/poster/747,https://www.ecva.net/papers/eccv_2024/papers_ECCV/papers/08064.pdf,2024 Poster
ECCV2024-1264,DEPICT: Diffusion-Enabled Permutation Importance for Image Classification Tasks,Sarah Jabbour; Gregory Kondas; Ella Kazerooni; Michael Sjoding; David Fouhey; Jenna Wiens,ECCV,2024,https://eccv.ecva.net/virtual/2024/poster/292,https://www.ecva.net/papers/eccv_2024/papers_ECCV/papers/08067.pdf,2024 Poster
ECCV2024-1265,Diagnosing and Re-learning for Balanced Multimodal Learning,Yake Wei; Siwei Li; Ruoxuan Feng; Di Hu,ECCV,2024,https://eccv.ecva.net/virtual/2024/poster/1924,https://www.ecva.net/papers/eccv_2024/papers_ECCV/papers/08072.pdf,2024 Poster
ECCV2024-1266,Meerkat: Audio-Visual Large Language Model for Grounding in Space and Time,Sanjoy Chowdhury; Sayan Nag; Subhrajyoti Dasgupta; jun chen; Mohamed Elhoseiny; Ruohan Gao; Dinesh Manocha,ECCV,2024,https://eccv.ecva.net/virtual/2024/poster/2580,https://www.ecva.net/papers/eccv_2024/papers_ECCV/papers/08071.pdf,2024 Poster
ECCV2024-1267,Elucidating the Hierarchical Nature of Behavior with Masked Autoencoders,Lucas Stoffl; Andy Bonnetto; Stéphane D&amp;#x27;Ascoli; Alexander Mathis,ECCV,2024,https://eccv.ecva.net/virtual/2024/poster/1463,https://www.ecva.net/papers/eccv_2024/papers_ECCV/papers/08076.pdf,2024 Poster
ECCV2024-1268,Contribution-based Low-Rank Adaptation with Pre-training Model for Real Image Restoration,Dongwon Park; Hayeon Kim; Se Young Chun,ECCV,2024,https://eccv.ecva.net/virtual/2024/poster/2298,https://www.ecva.net/papers/eccv_2024/papers_ECCV/papers/08074.pdf,2024 Poster
ECCV2024-1269,BeyondScene: Higher-Resolution Human-Centric Scene Generation With Pretrained Diffusion,Gwanghyun Kim; Hayeon Kim; Hoigi Seo; Dong Un Kang; Se Young Chun,ECCV,2024,https://eccv.ecva.net/virtual/2024/poster/931,https://www.ecva.net/papers/eccv_2024/papers_ECCV/papers/08077.pdf,2024 Poster
ECCV2024-1270,MMEarth: Exploring Multi-Modal Pretext Tasks For Geospatial Representation Learning,Vishal Nedungadi; Ankit Kariryaa; Stefan Oehmcke; Serge Belongie; Christian Igel; Nico Lang,ECCV,2024,https://eccv.ecva.net/virtual/2024/poster/740,https://www.ecva.net/papers/eccv_2024/papers_ECCV/papers/08085.pdf,2024 Poster
ECCV2024-1271,Ferret-UI: Grounded Mobile UI Understanding with Multimodal LLMs,Keen You; Haotian Zhang; Eldon Schoop; Floris Weers; Amanda Swearngin; Jeff Nichols; Yinfei Yang; Zhe Gan,ECCV,2024,https://eccv.ecva.net/virtual/2024/poster/749,https://www.ecva.net/papers/eccv_2024/papers_ECCV/papers/08095.pdf,2024 Poster
ECCV2024-1272,Bridging the Pathology Domain Gap: Efficiently Adapting CLIP for Pathology Image Analysis with Limited Labeled Data,Zhengfeng Lai; Joohi Chauhan; Brittany N. Dugger; Chen-Nee Chuah,ECCV,2024,https://eccv.ecva.net/virtual/2024/poster/430,https://www.ecva.net/papers/eccv_2024/papers_ECCV/papers/08099.pdf,2024 Poster
ECCV2024-1273,AugUndo: Scaling Up Augmentations for Monocular Depth Completion and Estimation,Yangchao Wu; Tian Yu Liu; Hyoungseob Park; Stefano Soatto; DONG LAO; Alex Wong,ECCV,2024,https://eccv.ecva.net/virtual/2024/poster/2093,https://www.ecva.net/papers/eccv_2024/papers_ECCV/papers/08100.pdf,2024 Poster
ECCV2024-1274,CARB-Net: Camera-Assisted Radar-Based Network for Vulnerable Road User Detection,Wei-Yu Lee; Martin Dimitrievski; David Van Hamme; Jan Aelterman; Ljubomir Jovanov; Wilfried Philips,ECCV,2024,https://eccv.ecva.net/virtual/2024/poster/240,https://www.ecva.net/papers/eccv_2024/papers_ECCV/papers/08101.pdf,2024 Poster
ECCV2024-1275,SAH-SCI: Self-Supervised Adapter for Efficient Hyperspectral Snapshot Compressive Imaging,Haijin Zeng; Yuxi Liu; Yongyong Chen; Youfa Liu; Chong Peng; Jingyong Su,ECCV,2024,https://eccv.ecva.net/virtual/2024/poster/314,https://www.ecva.net/papers/eccv_2024/papers_ECCV/papers/08105.pdf,2024 Poster
ECCV2024-1276,Minimalist Vision with Freeform Pixels,Jeremy Klotz; Shree Nayar,ECCV,2024,https://eccv.ecva.net/virtual/2024/poster/146,https://www.ecva.net/papers/eccv_2024/papers_ECCV/papers/08113.pdf,2024 Poster
ECCV2024-1277,All You Need is Your Voice: Emotional Face Representation with Audio Perspective for Emotional Talking Face Generation,Seongho Kim; Byung Cheol Song,ECCV,2024,https://eccv.ecva.net/virtual/2024/poster/891,https://www.ecva.net/papers/eccv_2024/papers_ECCV/papers/08116.pdf,2024 Poster
ECCV2024-1278,LatentEditor: Text Driven Local Editing of 3D Scenes,Umar Khalid; Hasan Iqbal; Muhammad Tayyab; Md Nazmul Karim; Jing Hua; Chen Chen,ECCV,2024,https://eccv.ecva.net/virtual/2024/poster/1317,https://www.ecva.net/papers/eccv_2024/papers_ECCV/papers/08118.pdf,2024 Poster
ECCV2024-1279,POET: Prompt Offset Tuning for Continual Human Action Adaptation,Prachi Garg; Joseph K J; Vineeth N Balasubramanian; Necati Cihan Camgoz; Chengde Wan; Kenrick Kin; Weiguang Si; Shugao Ma; Fernando de la Torre,ECCV,2024,https://eccv.ecva.net/virtual/2024/poster/1271,https://www.ecva.net/papers/eccv_2024/papers_ECCV/papers/08141.pdf,2024 Poster
ECCV2024-1280,IG Captioner: Information Gain Captioners are Strong Zero-shot Classifiers,Chenglin Yang; Siyuan Qiao; Yuan Cao; Yu Zhang; Tao Zhu; Alan Yuille; Jiahui Yu,ECCV,2024,https://eccv.ecva.net/virtual/2024/poster/1126,https://www.ecva.net/papers/eccv_2024/papers_ECCV/papers/08150.pdf,2024 Poster
ECCV2024-1281,Cross-Domain Semantic Segmentation on Inconsistent Taxonomy using VLMs,Jeongkee Lim; Yusung Kim,ECCV,2024,https://eccv.ecva.net/virtual/2024/poster/2628,https://www.ecva.net/papers/eccv_2024/papers_ECCV/papers/08161.pdf,2024 Poster
ECCV2024-1282,TrafficNight : An Aerial Multimodal Benchmark For Nighttime Vehicle Surveillance,Guoxing Zhang; Yiming Liu; xiaoyu yang; Chao Huang; HUANG Hailong,ECCV,2024,https://eccv.ecva.net/virtual/2024/poster/243,https://www.ecva.net/papers/eccv_2024/papers_ECCV/papers/08163.pdf,2024 Poster
ECCV2024-1283,Towards Open Domain Text-Driven Synthesis of Multi-Person Motions,Shan Mengyi; Lu Dong; Yutao Han; Yuan Yao; Tao Liu; Ifeoma Nwogu; Guo-Jun Qi; Mitch Hill,ECCV,2024,https://eccv.ecva.net/virtual/2024/poster/2489,https://www.ecva.net/papers/eccv_2024/papers_ECCV/papers/08171.pdf,2024 Poster
