id,title,authors,conference,year,official_page,pdf_link,status_or_award
ECCV2024-0598,Mind the Interference: Retaining Pre-trained Knowledge in Parameter Efficient Continual Learning of Vision-Language Models,Longxiang Tang; Zhuotao Tian; Kai Li; Chunming He; Hantao Zhou; Hengshuang ZHAO; Xiu Li; Jiaya Jia,ECCV,2024,https://eccv.ecva.net/virtual/2024/poster/1186,https://www.ecva.net/papers/eccv_2024/papers_ECCV/papers/05329.pdf,2024 Poster
ECCV2024-0599,Urban Waterlogging Detection: A Challenging Benchmark and Large-Small Model Co-Adapter,Suqi Song; Chenxu Zhang; Peng Zhang; Pengkun Li; Fenglong Song; Lei Zhang,ECCV,2024,https://eccv.ecva.net/virtual/2024/poster/800,https://www.ecva.net/papers/eccv_2024/papers_ECCV/papers/05333.pdf,2024 Poster
ECCV2024-0600,ReMoS: 3D Motion-Conditioned Reaction Synthesis for Two-Person Interactions,Anindita Ghosh; Rishabh Dabral; Vladislav Golyanik; Christian Theobalt; Philipp Slusallek,ECCV,2024,https://eccv.ecva.net/virtual/2024/poster/2124,https://www.ecva.net/papers/eccv_2024/papers_ECCV/papers/05358.pdf,2024 Poster
ECCV2024-0601,Trajectory-aligned Space-time Tokens for Few-shot Action Recognition,Pulkit Kumar; Namitha Padmanabhan; Luke Luo; Sai Saketh Rambhatla; Abhinav Shrivastava,ECCV,2024,https://eccv.ecva.net/virtual/2024/poster/1821,https://www.ecva.net/papers/eccv_2024/papers_ECCV/papers/05362.pdf,2024 Poster
ECCV2024-0602,Synchronization of Projective Transformations,Rakshith Madhavan; Andrea Fusiello; Federica Arrigoni,ECCV,2024,https://eccv.ecva.net/virtual/2024/poster/608,https://www.ecva.net/papers/eccv_2024/papers_ECCV/papers/05369.pdf,2024 Poster
ECCV2024-0603,U-COPE: Taking a Further Step to Universal 9D Category-level Object Pose Estimation,li zhang; Weiqing Meng; Yan Zhong; Bin Kong; Mingliang Xu; Jianming Du; Xue Wang; Rujing Wang; Liu Liu,ECCV,2024,https://eccv.ecva.net/virtual/2024/poster/614,https://www.ecva.net/papers/eccv_2024/papers_ECCV/papers/01566.pdf,2024 Poster
ECCV2024-0604,Insect Identification in the Wild: The AMI Dataset,Aditya Jain; Fagner Cunha; Michael J Bunsen; Juan Sebastián Cañas; Léonard Pasi; Nathan Pinoy; Flemming Helsing; JoAnne Russo; Marc S Botham; Michael Sabourin; Jonathan Fréchette; Alexandre Anctil; Yacksecari Lopez; Eduardo Navarro; Filonila Pérez; Ana C Zamora; Jose Alejandro Ramirez-Silva; Jonathan Gagnon; Tom A August; Kim Bjerge; Alba Gomez Segura; Marc Belisle; Yves Basset; Kent P McFarland; David B Roy; Toke T Høye; Maxim Larrivee; David Rolnick,ECCV,2024,https://eccv.ecva.net/virtual/2024/poster/859,https://www.ecva.net/papers/eccv_2024/papers_ECCV/papers/05373.pdf,2024 Poster
ECCV2024-0605,Test-time Model Adaptation for Image Reconstruction Using Self-supervised Adaptive Layers,Zhao Yutian; Tianjing Zhang; Hui JI,ECCV,2024,https://eccv.ecva.net/virtual/2024/poster/1800,https://www.ecva.net/papers/eccv_2024/papers_ECCV/papers/05391.pdf,2024 Poster
ECCV2024-0606,CMTA: Cross-Modal Temporal Alignment for Event-guided Video Deblurring,Taewoo Kim; Hoonhee Cho; KUK-JIN YOON,ECCV,2024,https://eccv.ecva.net/virtual/2024/poster/259,https://www.ecva.net/papers/eccv_2024/papers_ECCV/papers/06838.pdf,2024 Poster
ECCV2024-0607,This Probably Looks Exactly Like That: An Invertible Prototypical Network,Zachariah Carmichael; Timothy Redgrave; Daniel Gonzalez Cedre; Walter Scheirer,ECCV,2024,https://eccv.ecva.net/virtual/2024/poster/452,https://www.ecva.net/papers/eccv_2024/papers_ECCV/papers/05439.pdf,2024 Poster
ECCV2024-0608,GenRC: Generative 3D Room Completion from Sparse Image Collections,Ming-Feng Li; Yueh-Feng Ku; Hong-Xuan Yen; Chi Liu; Yu-Lun Liu; Albert Y Chen; Cheng-Hao Kuo; Min Sun,ECCV,2024,https://eccv.ecva.net/virtual/2024/poster/2408,https://www.ecva.net/papers/eccv_2024/papers_ECCV/papers/05406.pdf,2024 Poster
ECCV2024-0609,Towards Open-ended Visual Quality Comparison,Haoning Wu; Hanwei Zhu; Zicheng Zhang; Erli Zhang; Chaofeng Chen; Liang Liao; Chunyi Li; Annan Wang; Wenxiu Sun; Qiong Yan; Xiaohong Liu; Guangtao Zhai; Shiqi Wang; Weisi Lin,ECCV,2024,https://eccv.ecva.net/virtual/2024/poster/861,https://www.ecva.net/papers/eccv_2024/papers_ECCV/papers/00422.pdf,2024 Poster
ECCV2024-0610,EgoPet: Egomotion and Interaction Data from an Animal's Perspective,Amir Bar; Arya Bakhtiar; Danny L Tran; Antonio Loquercio; Jathushan Rajasegaran; yann lecun; Amir Globerson; Trevor Darrell,ECCV,2024,https://eccv.ecva.net/virtual/2024/poster/2104,https://www.ecva.net/papers/eccv_2024/papers_ECCV/papers/05469.pdf,2024 Poster
ECCV2024-0611,Neural graphics texture compression supporting random access,Farzad Farhadzadeh; Qiqi Hou; Hoang Le; Amir Said; Randall R Rauwendaal; Alex Bourd; Fatih Porikli,ECCV,2024,https://eccv.ecva.net/virtual/2024/poster/565,https://www.ecva.net/papers/eccv_2024/papers_ECCV/papers/05476.pdf,2024 Poster
ECCV2024-0612,Contrastive Learning with Synthetic Positives,Dewen Zeng; Xinrong Hu; Yawen Wu; Xiaowei Xu; Yiyu Shi,ECCV,2024,https://eccv.ecva.net/virtual/2024/poster/1185,https://www.ecva.net/papers/eccv_2024/papers_ECCV/papers/05479.pdf,2024 Poster
ECCV2024-0613,GeneralAD: Anomaly Detection Across Domains by Attending to Distorted Features,Luc Sträter; Mohammadreza Salehi; Efstratios Gavves; Cees Snoek; Yuki M Asano,ECCV,2024,https://eccv.ecva.net/virtual/2024/poster/2652,https://www.ecva.net/papers/eccv_2024/papers_ECCV/papers/05481.pdf,2024 Poster
ECCV2024-0614,DIM: Dyadic Interaction Modeling for Social Behavior Generation,Minh Tran; Di Chang; Maksim Siniukov; Mohammad Soleymani,ECCV,2024,https://eccv.ecva.net/virtual/2024/poster/2487,https://www.ecva.net/papers/eccv_2024/papers_ECCV/papers/05491.pdf,2024 Poster
ECCV2024-0615,ControlCap: Controllable Region-level Captioning,Yuzhong Zhao; Liu Yue; Zonghao Guo; Weijia Wu; Chen Gong; Qixiang Ye; Fang Wan,ECCV,2024,https://eccv.ecva.net/virtual/2024/poster/1506,https://www.ecva.net/papers/eccv_2024/papers_ECCV/papers/05494.pdf,2024 Poster
ECCV2024-0616,MaxFusion: Plug&Play Multi-Modal Generation in Text-to-Image Diffusion Models,Nithin Gopalakrishnan Nair; Jeya Maria Jose Valanarasu; Vishal Patel,ECCV,2024,https://eccv.ecva.net/virtual/2024/poster/1028,https://www.ecva.net/papers/eccv_2024/papers_ECCV/papers/05506.pdf,2024 Poster
ECCV2024-0617,Watch Your Steps: Local Image and Scene Editing by Text Instructions,Ashkan Mirzaei; Tristan T Aumentado-Armstrong; Marcus A Brubaker; Jonathan Kelly; Alex Levinshtein; Konstantinos Derpanis; Igor Gilitschenski,ECCV,2024,https://eccv.ecva.net/virtual/2024/poster/1237,https://www.ecva.net/papers/eccv_2024/papers_ECCV/papers/05512.pdf,2024 Poster
ECCV2024-0618,Forget More to Learn More: Domain-specific Feature Unlearning for Semi-supervised and Unsupervised Domain Adaptation,Hritam Basak; Zhaozheng Yin,ECCV,2024,https://eccv.ecva.net/virtual/2024/poster/2314,https://www.ecva.net/papers/eccv_2024/papers_ECCV/papers/05513.pdf,2024 Poster
ECCV2024-0619,LLM as Dataset Analyst: Subpopulation Structure Discovery with Large Language Model,Yulin Luo; Ruichuan An; Bocheng Zou; Yiming Tang; Jiaming Liu; Shanghang Zhang,ECCV,2024,https://eccv.ecva.net/virtual/2024/poster/2242,https://www.ecva.net/papers/eccv_2024/papers_ECCV/papers/04858.pdf,2024 Poster
ECCV2024-0620,3x2: 3D Object Part Segmentation by 2D Semantic Correspondences,Anh Thai; Weiyao Wang; Hao Tang; Stefan Stojanov; James Rehg; Matt Feiszli,ECCV,2024,https://eccv.ecva.net/virtual/2024/poster/788,https://www.ecva.net/papers/eccv_2024/papers_ECCV/papers/05514.pdf,2024 Poster
ECCV2024-0621,CityGaussian: Real-time High-quality Large-Scale Scene Rendering with Gaussians,Yang Liu; Chuanchen Luo; Lue Fan; Naiyan Wang; Junran Peng; Zhaoxiang Zhang,ECCV,2024,https://eccv.ecva.net/virtual/2024/poster/178,https://www.ecva.net/papers/eccv_2024/papers_ECCV/papers/02472.pdf,2024 Poster
ECCV2024-0622,Fisher Calibration for Backdoor-Robust Heterogeneous Federated Learning,Wenke Huang; Mang Ye; zekun shi; Bo Du; Dacheng Tao,ECCV,2024,https://eccv.ecva.net/virtual/2024/poster/445,https://www.ecva.net/papers/eccv_2024/papers_ECCV/papers/02353.pdf,2024 Poster
ECCV2024-0623,A Semantic Space is Worth 256 Language Descriptions: Make Stronger Segmentation Models with Descriptive Properties,Junfei Xiao; Ziqi Zhou; Wenxuan Li; Shiyi Lan; Jieru Mei; Zhiding Yu; Bingchen Zhao; Alan Yuille; Yuyin Zhou; Cihang Xie,ECCV,2024,https://eccv.ecva.net/virtual/2024/poster/1881,https://www.ecva.net/papers/eccv_2024/papers_ECCV/papers/05527.pdf,2024 Poster
ECCV2024-0624,Fast View Synthesis of Casual Videos with Soup-of-Planes,Yao-Chih Lee; Zhoutong Zhang; Kevin Blackburn-Matzen; Simon Niklaus; Jianming Zhang; Jia-Bin Huang; Feng Liu,ECCV,2024,https://eccv.ecva.net/virtual/2024/poster/1664,https://www.ecva.net/papers/eccv_2024/papers_ECCV/papers/05533.pdf,2024 Poster
ECCV2024-0625,Confidence Self-Calibration for Multi-Label Class-Incremental Learning,Kaile Du; Yifan Zhou; Fan Lyu; Yuyang Li; Chen Lu; Guangcan Liu,ECCV,2024,https://eccv.ecva.net/virtual/2024/poster/456,https://www.ecva.net/papers/eccv_2024/papers_ECCV/papers/04537.pdf,2024 Poster
ECCV2024-0626,Video Question Answering with Procedural Programs,Rohan Choudhury; Koichiro Niinuma; Kris Kitani; Laszlo Jeni,ECCV,2024,https://eccv.ecva.net/virtual/2024/poster/2211,https://www.ecva.net/papers/eccv_2024/papers_ECCV/papers/05543.pdf,2024 Poster
ECCV2024-0627,DGR-MIL: Exploring Diverse Global Representation in Multiple Instance Learning for Whole Slide Image Classification,Wenhui Zhu; Xiwen Chen; Peijie Qiu; Aristeidis Sotiras; Abolfazl Razi; Yalin Wang,ECCV,2024,https://eccv.ecva.net/virtual/2024/poster/2647,https://www.ecva.net/papers/eccv_2024/papers_ECCV/papers/05548.pdf,2024 Poster
ECCV2024-0628,Elegantly Written: Disentangling Writer and Character Styles for Enhancing Online Chinese Handwriting,Yu Liu; Fatimah binti Khalid; Lei Wang; Youxi Zhang; Cunrui Wang,ECCV,2024,https://eccv.ecva.net/virtual/2024/poster/276,https://www.ecva.net/papers/eccv_2024/papers_ECCV/papers/01329.pdf,2024 Poster
ECCV2024-0629,SlotLifter: Slot-guided Feature Lifting for Learning Object-Centric Radiance Fields,Yu Liu; Baoxiong Jia; Yixin Chen; Siyuan Huang,ECCV,2024,https://eccv.ecva.net/virtual/2024/poster/558,https://www.ecva.net/papers/eccv_2024/papers_ECCV/papers/01406.pdf,2024 Poster
ECCV2024-0630,Representation Enhancement-Stabilization: Reducing Bias-Variance of Domain Generalization,Wei Huang; Yilei Shi; Zhitong Xiong; Xiao Xiang Zhu,ECCV,2024,https://eccv.ecva.net/virtual/2024/poster/466,https://www.ecva.net/papers/eccv_2024/papers_ECCV/papers/05278.pdf,2024 Poster
ECCV2024-0631,LLMGA: Multimodal Large Language Model based Generation Assistant,Bin Xia; Shiyin Wang; Yingfan Tao; Yitong Wang; Jiaya Jia,ECCV,2024,https://eccv.ecva.net/virtual/2024/poster/535,https://www.ecva.net/papers/eccv_2024/papers_ECCV/papers/05554.pdf,2024 Poster
ECCV2024-0632,Shape from Heat Conduction,Sriram Narayanan; Mani Ramanagopal; Mark Sheinin; Aswin C. Sankaranarayanan; Srinivasa G. Narasimhan,ECCV,2024,https://eccv.ecva.net/virtual/2024/poster/2369,https://www.ecva.net/papers/eccv_2024/papers_ECCV/papers/05559.pdf,2024 Poster
ECCV2024-0633,Learn from the Learnt: Source-Free Active Domain Adaptation via Contrastive Sampling and Visual Persistence,Mengyao Lyu; Tianxiang Hao; Xinhao Xu; Hui Chen; Zijia Lin; Jungong Han; Guiguang Ding,ECCV,2024,https://eccv.ecva.net/virtual/2024/poster/2680,https://www.ecva.net/papers/eccv_2024/papers_ECCV/papers/00073.pdf,2024 Poster
ECCV2024-0634,HandDGP: Camera-Space Hand Mesh Prediction with Differentiable Global Positioning,Eugene Valassakis; Guillermo Garcia-Hernando,ECCV,2024,https://eccv.ecva.net/virtual/2024/poster/2088,https://www.ecva.net/papers/eccv_2024/papers_ECCV/papers/05563.pdf,2024 Poster
ECCV2024-0635,Mutual Learning for Acoustic Matching and Dereverberation via Visual Scene-driven Diffusion,Jian Ma; Wenguan Wang; Yi Yang; Feng Zheng,ECCV,2024,https://eccv.ecva.net/virtual/2024/poster/1096,https://www.ecva.net/papers/eccv_2024/papers_ECCV/papers/02790.pdf,2024 Poster
ECCV2024-0636,Towards High-Quality 3D Motion Transfer with Realistic Apparel Animation,Rong Wang; Wei Mao; Changsheng Lu; HONGDONG LI,ECCV,2024,https://eccv.ecva.net/virtual/2024/poster/936,https://www.ecva.net/papers/eccv_2024/papers_ECCV/papers/05572.pdf,2024 Poster
ECCV2024-0637,AnyHome: Open-Vocabulary Large-Scale Indoor Scene Generation with First-Person View Exploration,Rao Fu; Zehao Wen; Zichen Liu; Srinath Sridhar,ECCV,2024,https://eccv.ecva.net/virtual/2024/poster/196,https://www.ecva.net/papers/eccv_2024/papers_ECCV/papers/05573.pdf,2024 Poster
ECCV2024-0638,Better Call SAL: Towards Learning to Segment Anything in Lidar,Aljoša Ošep; Tim Meinhardt; Francesco Ferroni; Neehar Peri; Deva Ramanan; Laura Leal-Taixe,ECCV,2024,https://eccv.ecva.net/virtual/2024/poster/2629,https://www.ecva.net/papers/eccv_2024/papers_ECCV/papers/05575.pdf,2024 Poster
ECCV2024-0639,DGInStyle: Domain-Generalizable Semantic Segmentation with Image Diffusion Models and Stylized Semantic Control,Yuru Jia; Lukas Hoyer; Shengyu Huang; Tianfu Wang; Luc Van Gool; Konrad Schindler; Anton Obukhov,ECCV,2024,https://eccv.ecva.net/virtual/2024/poster/1378,https://www.ecva.net/papers/eccv_2024/papers_ECCV/papers/05579.pdf,2024 Poster
ECCV2024-0640,iMatching: Imperative Correspondence Learning,Chen Wang; Dasong Gao; Yun-Jou Lin; Youjie Xia; Chen Wang,ECCV,2024,https://eccv.ecva.net/virtual/2024/poster/216,https://www.ecva.net/papers/eccv_2024/papers_ECCV/papers/05586.pdf,2024 Poster
ECCV2024-0641,Appearance-based Refinement for Object-Centric Motion Segmentation,Junyu Xie; Weidi Xie; Andrew ZISSERMAN,ECCV,2024,https://eccv.ecva.net/virtual/2024/poster/2202,https://www.ecva.net/papers/eccv_2024/papers_ECCV/papers/05594.pdf,2024 Poster
ECCV2024-0642,Open Panoramic Segmentation,Junwei Zheng; Ruiping Liu; Yufan Chen; Kunyu Peng; Chengzhi Wu; Kailun Yang; Jiaming Zhang; Rainer Stiefelhagen,ECCV,2024,https://eccv.ecva.net/virtual/2024/poster/1815,https://www.ecva.net/papers/eccv_2024/papers_ECCV/papers/05584.pdf,2024 Poster
ECCV2024-0643,Open Vocabulary Multi-Label Video Classification,Rohit Gupta; Mamshad Nayeem Rizve; Jayakrishnan Unnikrishnan; Ashish Tawari; Son Tran; Shah Mubarak; Benjamin Yao; Trishul A Chilimbi,ECCV,2024,https://eccv.ecva.net/virtual/2024/poster/1471,https://www.ecva.net/papers/eccv_2024/papers_ECCV/papers/05599.pdf,2024 Poster
ECCV2024-0644,Shape-guided Configuration-aware Learning for Endoscopic-image-based Pose Estimation of Flexible Robotic Instruments,YIYAO MA; Kai Chen; Hon-Sing Tong; Ruofeng Wei; Yui-Lun Ng; Ka-Wai Kwok; Qi Dou,ECCV,2024,https://eccv.ecva.net/virtual/2024/poster/220,https://www.ecva.net/papers/eccv_2024/papers_ECCV/papers/03268.pdf,2024 Poster
ECCV2024-0645,MICDrop: Masking Image and Depth Features via Complementary Dropout for Domain-Adaptive Semantic Segmentation,Linyan Yang; Lukas Hoyer; Mark Weber; Tobias Fischer; Dengxin Dai; Laura Leal-Taixe; Daniel Cremers; Marc Pollefeys; Luc Van Gool,ECCV,2024,https://eccv.ecva.net/virtual/2024/poster/2630,https://www.ecva.net/papers/eccv_2024/papers_ECCV/papers/05609.pdf,2024 Poster
ECCV2024-0646,GeoWizard: Unleashing the Diffusion Priors for 3D Geometry Estimation from a Single Image,Xiao Fu; Wei Yin; Mu Hu; Kaixuan Wang; Yuexin Ma; Ping Tan; Shaojie Shen; Dahua Lin; Xiaoxiao Long,ECCV,2024,https://eccv.ecva.net/virtual/2024/poster/1666,https://www.ecva.net/papers/eccv_2024/papers_ECCV/papers/03265.pdf,2024 Poster
ECCV2024-0647,Efficient Pre-training for Localized Instruction Generation of Procedural Videos,Anil Batra; Davide Moltisanti; Laura Sevilla-Lara; Marcus Rohrbach; Frank Keller,ECCV,2024,https://eccv.ecva.net/virtual/2024/poster/734,https://www.ecva.net/papers/eccv_2024/papers_ECCV/papers/05611.pdf,2024 Poster
ECCV2024-0648,MTKD: Multi-Teacher Knowledge Distillation for Image Super-Resolution,Yuxuan Jiang; Chen Feng; Fan Zhang; David Bull,ECCV,2024,https://eccv.ecva.net/virtual/2024/poster/2688,https://www.ecva.net/papers/eccv_2024/papers_ECCV/papers/05614.pdf,2024 Poster
ECCV2024-0649,DEAL: Disentangle and Localize Concept-level Explanations for VLMs,Tang Li; Mengmeng Ma; Xi Peng,ECCV,2024,https://eccv.ecva.net/virtual/2024/poster/755,https://www.ecva.net/papers/eccv_2024/papers_ECCV/papers/05615.pdf,2024 Poster
ECCV2024-0650,RoadPainter: Points Are Ideal Navigators for Topology transformER,Zhongxing Ma; Liang Shuang; Yongkun Wen; Weixin Lu; Guowei Wan,ECCV,2024,https://eccv.ecva.net/virtual/2024/poster/992,https://www.ecva.net/papers/eccv_2024/papers_ECCV/papers/01878.pdf,2024 Poster
ECCV2024-0651,Surf-D: Generating High-Quality Surfaces of Arbitrary Topologies Using Diffusion Models,Zhengming Yu; Zhiyang Dou; Xiaoxiao Long; Cheng Lin; Zekun Li; Yuan Liu; Norman Müller; Taku Komura; Marc Habermann; Christian Theobalt; Xin Li; Wenping Wang,ECCV,2024,https://eccv.ecva.net/virtual/2024/poster/1323,https://www.ecva.net/papers/eccv_2024/papers_ECCV/papers/05619.pdf,2024 Poster
ECCV2024-0652,Diffusion-Refined VQA Annotations for Semi-Supervised Gaze Following,Qiaomu Miao; Alexandros Graikos; Jingwei Zhang; Sounak Mondal; Minh Hoai; Dimitris Samaras,ECCV,2024,https://eccv.ecva.net/virtual/2024/poster/2611,https://www.ecva.net/papers/eccv_2024/papers_ECCV/papers/05621.pdf,2024 Poster
ECCV2024-0653,IMMA: Immunizing text-to-image Models against Malicious Adaptation,Amber Yijia Zheng; Raymond Yeh,ECCV,2024,https://eccv.ecva.net/virtual/2024/poster/682,https://www.ecva.net/papers/eccv_2024/papers_ECCV/papers/05625.pdf,2024 Poster
ECCV2024-0654,ReALFRED: An Embodied Instruction Following Benchmark in Photo-Realistic Environments,Taewoong Kim; Cheolhong Min; Byeonghwi Kim; Jinyeon Kim; Wonje Jeung; Jonghyun Choi,ECCV,2024,https://eccv.ecva.net/virtual/2024/poster/2589,https://www.ecva.net/papers/eccv_2024/papers_ECCV/papers/01610.pdf,2024 Poster
ECCV2024-0655,SPAMming Labels: Efficient Annotations for the Trackers of Tomorrow,Orcun Cetintas; Tim Meinhardt; Guillem Brasó; Laura Leal-Taixe,ECCV,2024,https://eccv.ecva.net/virtual/2024/poster/2558,https://www.ecva.net/papers/eccv_2024/papers_ECCV/papers/01927.pdf,2024 Poster
ECCV2024-0656,GeoCalib: Learning Single-image Calibration with Geometric Optimization,Alexander Veicht; Paul-Edouard Sarlin; Philipp Lindenberger; Marc Pollefeys,ECCV,2024,https://eccv.ecva.net/virtual/2024/poster/1349,https://www.ecva.net/papers/eccv_2024/papers_ECCV/papers/05636.pdf,2024 Poster
ECCV2024-0657,3D Open-Vocabulary Panoptic Segmentation with 2D-3D Vision-Language Distillation,Zihao Xiao; Longlong Jing; Shangxuan Wu; Alex Zihao Zhu; Jingwei Ji; Chiyu Max Jiang; Wei-Chih Hung; Thomas Funkhouser; Weicheng Kuo; Anelia Angelova; Yin Zhou; Shiwei Sheng,ECCV,2024,https://eccv.ecva.net/virtual/2024/poster/2264,https://www.ecva.net/papers/eccv_2024/papers_ECCV/papers/05642.pdf,2024 Poster
ECCV2024-0658,ReMatching: Low-Resolution Representations for Scalable Shape Correspondence,Filippo Maggioli; Daniele Baieri; Emanuele Rodola; Simone Melzi,ECCV,2024,https://eccv.ecva.net/virtual/2024/poster/202,https://www.ecva.net/papers/eccv_2024/papers_ECCV/papers/05411.pdf,2024 Poster
ECCV2024-0659,Semicalibrated Relative Pose from an Affine Correspondence and Monodepth,Petr Hrubý; Marc Pollefeys; Daniel Barath,ECCV,2024,https://eccv.ecva.net/virtual/2024/poster/609,https://www.ecva.net/papers/eccv_2024/papers_ECCV/papers/05645.pdf,2024 Poster
ECCV2024-0660,Global Structure-from-Motion Revisited,Linfei Pan; Daniel Barath; Marc Pollefeys; Johannes L Schönberger,ECCV,2024,https://eccv.ecva.net/virtual/2024/poster/1699,https://www.ecva.net/papers/eccv_2024/papers_ECCV/papers/05646.pdf,2024 Poster
ECCV2024-0661,Gravity-aligned Rotation Averaging with Circular Regression,Linfei Pan; Marc Pollefeys; Daniel Barath,ECCV,2024,https://eccv.ecva.net/virtual/2024/poster/1348,https://www.ecva.net/papers/eccv_2024/papers_ECCV/papers/05651.pdf,2024 Poster
ECCV2024-0662,MoMA: Multimodal LLM Adapter for Fast Personalized Image Generation,KUNPENG SONG; Yizhe Zhu; Bingchen Liu; Qing Yan; Ahmed Elgammal; Xiao Yang,ECCV,2024,https://eccv.ecva.net/virtual/2024/poster/2606,https://www.ecva.net/papers/eccv_2024/papers_ECCV/papers/05653.pdf,2024 Poster
ECCV2024-0663,Find n' Propagate: Open-Vocabulary 3D Object Detection in Urban Environments,Djamahl Etchegaray; Zi Helen Huang; Tatsuya Harada; Yadan Luo,ECCV,2024,https://eccv.ecva.net/virtual/2024/poster/776,https://www.ecva.net/papers/eccv_2024/papers_ECCV/papers/05654.pdf,2024 Poster
ECCV2024-0664,Quanta Video Restoration,PRATEEK CHENNURI; Yiheng Chi; Enze Jiang; GM Dilshan Godaliyadda; Abhiram Gnanasambandam; Hamid R Sheikh; Istvan Gyongy; Stanley Chan,ECCV,2024,https://eccv.ecva.net/virtual/2024/poster/704,https://www.ecva.net/papers/eccv_2024/papers_ECCV/papers/05655.pdf,2024 Poster
ECCV2024-0665,Concept Sliders: LoRA Adaptors for Precise Control in Diffusion Models,Rohit Gandikota; Joanna Materzynska; Tingrui Zhou; Antonio Torralba; David Bau,ECCV,2024,https://eccv.ecva.net/virtual/2024/poster/2500,https://www.ecva.net/papers/eccv_2024/papers_ECCV/papers/05660.pdf,2024 Poster
ECCV2024-0666,A Probability-guided Sampler for Neural Implicit Surface Rendering,Gonçalo José Dias Pais; Valter André Piedade; Moitreya Chatterjee; Marcus Greiff; Pedro Miraldo,ECCV,2024,https://eccv.ecva.net/virtual/2024/poster/1647,https://www.ecva.net/papers/eccv_2024/papers_ECCV/papers/05407.pdf,2024 Poster
ECCV2024-0667,CAT-SAM: Conditional Tuning for Few-Shot Adaptation of Segment Anything Model,Aoran Xiao; Weihao Xuan; Heli Qi; Yun Xing; Ruijie Ren; Xiaoqin Zhang; Ling Shao; Shijian Lu,ECCV,2024,https://eccv.ecva.net/virtual/2024/poster/1599,https://www.ecva.net/papers/eccv_2024/papers_ECCV/papers/05662.pdf,2024 Poster
ECCV2024-0668,ScribblePrompt: Fast and Flexible Interactive Segmentation for Any Biomedical Image,Hallee E. Wong; Marianne Rakic; John Guttag; Adrian V. Dalca,ECCV,2024,https://eccv.ecva.net/virtual/2024/poster/803,https://www.ecva.net/papers/eccv_2024/papers_ECCV/papers/05664.pdf,2024 Poster
ECCV2024-0669,FinePseudo: Improving Pseudo-Labelling through Temporal-Alignablity for Semi-Supervised Fine-Grained Action Recognition,Ishan Rajendrakumar Dave; Mamshad Nayeem Rizve; Shah Mubarak,ECCV,2024,https://eccv.ecva.net/virtual/2024/poster/1464,https://www.ecva.net/papers/eccv_2024/papers_ECCV/papers/01319.pdf,2024 Poster
ECCV2024-0670,POCA: Post-training Quantization with Temporal Alignment for Codec Avatars,Jian Meng; Yuecheng Li; CHENGHUI Li; Syed Shakib Sarwar; Dilin Wang; Jae-sun Seo,ECCV,2024,https://eccv.ecva.net/virtual/2024/poster/896,https://www.ecva.net/papers/eccv_2024/papers_ECCV/papers/05670.pdf,2024 Poster
ECCV2024-0671,HYPE: Hyperbolic Entailment Filtering for Underspecified Images and Texts,Wonjae Kim; Sanghyuk Chun; Taekyung Kim; Dongyoon Han; Sangdoo Yun,ECCV,2024,https://eccv.ecva.net/virtual/2024/poster/2007,https://www.ecva.net/papers/eccv_2024/papers_ECCV/papers/05671.pdf,2024 Poster
ECCV2024-0672,Receler: Reliable Concept Erasing of Text-to-Image Diffusion Models via Lightweight Erasers,Chi-Pin Huang; Kai-Po Chang; Chung-Ting Tsai; Yung-Hsuan Lai; Fu-En Yang; Yu-Chiang Frank Wang,ECCV,2024,https://eccv.ecva.net/virtual/2024/poster/290,https://www.ecva.net/papers/eccv_2024/papers_ECCV/papers/05685.pdf,2024 Poster
ECCV2024-0673,Bridging the Gap: Studio-like Avatar Creation from a Monocular Phone Capture,ShahRukh Athar; Shunsuke Saito; Stanislav Pidhorskyi; Zhengyu Yang; Chen Cao,ECCV,2024,https://eccv.ecva.net/virtual/2024/poster/539,https://www.ecva.net/papers/eccv_2024/papers_ECCV/papers/01834.pdf,2024 Poster
ECCV2024-0674,A Secure Image Watermarking Framework with Statistical Guarantees via Adversarial Attacks on Secret Key Networks,Feiyu CHEN; Wei Lin; Ziquan Liu; Antoni Chan,ECCV,2024,https://eccv.ecva.net/virtual/2024/poster/1448,https://www.ecva.net/papers/eccv_2024/papers_ECCV/papers/05695.pdf,2024 Poster
ECCV2024-0675,HiT-SR: Hierarchical Transformer for Efficient Image Super-Resolution,Xiang Zhang; Yulun Zhang; Fisher Yu,ECCV,2024,https://eccv.ecva.net/virtual/2024/poster/2375,https://www.ecva.net/papers/eccv_2024/papers_ECCV/papers/05709.pdf,2024 Poster
ECCV2024-0676,Audio-Synchronized Visual Animation,Lin Zhang; Shentong Mo; Yijing Zhang; Pedro Morgado,ECCV,2024,https://eccv.ecva.net/virtual/2024/poster/1399,https://www.ecva.net/papers/eccv_2024/papers_ECCV/papers/05712.pdf,2024 Poster
ECCV2024-0677,Expressive Whole-Body 3D Gaussian Avatar,Gyeongsik Moon; Takaaki Shiratori; Shunsuke Saito,ECCV,2024,https://eccv.ecva.net/virtual/2024/poster/2381,https://www.ecva.net/papers/eccv_2024/papers_ECCV/papers/05715.pdf,2024 Poster
ECCV2024-0678,Reason2Drive: Towards Interpretable and Chain-based Reasoning for Autonomous Driving,Ming Nie; Renyuan Peng; Chunwei Wang; Xinyue Cai; Jianhua Han; Hang Xu; Li Zhang,ECCV,2024,https://eccv.ecva.net/virtual/2024/poster/2587,https://www.ecva.net/papers/eccv_2024/papers_ECCV/papers/03786.pdf,2024 Poster
ECCV2024-0679,DoughNet: A Visual Predictive Model for Topological Manipulation of Deformable Objects,Dominik Bauer; Zhenjia Xu; Shuran Song,ECCV,2024,https://eccv.ecva.net/virtual/2024/poster/1328,https://www.ecva.net/papers/eccv_2024/papers_ECCV/papers/05729.pdf,2024 Poster
ECCV2024-0680,PAV: Personalized Head Avatar from Unstructured Video Collection,Akin Caliskan; Berkay Kicanaoglu; H K,ECCV,2024,https://eccv.ecva.net/virtual/2024/poster/2379,https://www.ecva.net/papers/eccv_2024/papers_ECCV/papers/05730.pdf,2024 Poster
ECCV2024-0681,Strike a Balance in Continual Panoptic Segmentation,Jinpeng Chen; Runmin Cong; Yuxuan Luo; Horace Ho Shing Ip; Sam Kwong,ECCV,2024,https://eccv.ecva.net/virtual/2024/poster/1565,https://www.ecva.net/papers/eccv_2024/papers_ECCV/papers/05733.pdf,2024 Poster
ECCV2024-0682,MultiDelete for Multimodal Machine Unlearning,Jiali Cheng; Hadi Amiri,ECCV,2024,https://eccv.ecva.net/virtual/2024/poster/446,https://www.ecva.net/papers/eccv_2024/papers_ECCV/papers/05743.pdf,2024 Poster
