id,title,authors,conference,year,level,category,official_page,pdf_link,abstract,matched_keywords,classification_reason,card_path,notes
ICLR2024-1807,Certified Adversarial Robustness for Rate Encoded Spiking Neural Networks,"Bhaskar Mukhoty, Hilal AlQuabeh, Giulia De Masi, Huan Xiong, Bin Gu",ICLR,2024,C,SNN,https://proceedings.iclr.cc/paper_files/paper/2024/hash/ca24eb48806df3af49e5ac59d8a46f67-Abstract-Conference.html,https://proceedings.iclr.cc/paper_files/paper/2024/file/ca24eb48806df3af49e5ac59d8a46f67-Paper-Conference.pdf,"The spiking neural networks are inspired by the biological neurons that employ binary spikes to propagate information in the neural network. It has garnered considerable attention as the next-generation neural network, as the spiking activity simplifies the computation burden of the network to a large extent and is known for its low energy deployment enabled by specialized neuromorphic hardware. One popular technique to feed a static image to such a network is rate encoding, where each pixel is encoded into random binary spikes, following a Bernoulli distribution that uses the pixel intensity as bias. By establishing a novel connection between rate-encoding and randomized smoothing, we give the first provable robustness guarantee for spiking neural networks against adversarial perturbation of inputs bounded under $l_1$-norm. We introduce novel adversarial training algorithms for rate-encoded models that significantly improve the state-of-the-art empirical robust accuracy result. Experimental validation of the method is performed across various static image datasets, including CIFAR-10, CIFAR-100 and ImageNet-100. The code is available at \url{https://github.com/BhaskarMukhoty/CertifiedSNN}.",spiking neural networks; spiking,Official abstract/page strictly confirms SNN/spiking neural computation; no clear event-camera/DVS evidence found.,01-papers-by-conference/ICLR2024/C/2024-ICLR-C-certified-adversarial-robustness-for-rate-encoded-spiking-neural-networks.md,strict two-stage screening; official abstract/page inspected; main conference; needs human verification
ICLR2024-1982,Towards Energy Efficient Spiking Neural Networks: An Unstructured Pruning Framework,"Xinyu Shi, Jianhao Ding, Zecheng Hao, Zhaofei Yu",ICLR,2024,C,SNN,https://proceedings.iclr.cc/paper_files/paper/2024/hash/dd3c889922df2112a5b1769e3c19e28e-Abstract-Conference.html,https://proceedings.iclr.cc/paper_files/paper/2024/file/dd3c889922df2112a5b1769e3c19e28e-Paper-Conference.pdf,"Spiking Neural Networks (SNNs) have emerged as energy-efficient alternatives to Artificial Neural Networks (ANNs) when deployed on neuromorphic chips. While recent studies have demonstrated the impressive performance of deep SNNs on challenging tasks, their energy efficiency advantage has been diminished. Existing methods targeting energy consumption reduction do not fully exploit sparsity, whereas powerful pruning methods can achieve high sparsity but are not directly targeted at energy efficiency, limiting their effectiveness in energy saving. Furthermore, none of these works fully exploit the sparsity of neurons or the potential for unstructured neuron pruning in SNNs. In this paper, we propose a novel pruning framework that combines unstructured weight pruning with unstructured neuron pruning to maximize the utilization of the sparsity of neuromorphic computing, thereby enhancing energy efficiency. To the best of our knowledge, this is the first application of unstructured neuron pruning to deep SNNs. Experimental results demonstrate that our method achieves impressive energy efficiency gains. The sparse network pruned by our method with only 0.63\% remaining connections can achieve a remarkable 91 times increase in energy efficiency compared to the original dense network, requiring only 8.5M SOPs for inference, with merely 2.19\% accuracy loss on the CIFAR-10 dataset. Our work suggests that deep and dense SNNs exhibit high redundancy in energy consumption, highlighting the potential for targeted SNN sparsification to save energy.",spiking neural networks; spiking,Official abstract/page strictly confirms SNN/spiking neural computation; no clear event-camera/DVS evidence found.,01-papers-by-conference/ICLR2024/C/2024-ICLR-C-towards-energy-efficient-spiking-neural-networks-an-unstructured-pruning-framework.md,strict two-stage screening; official abstract/page inspected; main conference; needs human verification
ICLR2024-2070,Spike-driven Transformer V2: Meta Spiking Neural Network Architecture Inspiring the Design of Next-generation Neuromorphic Chips,"Man Yao, Jiakui Hu, Tianxiang Hu, Yifan Xu, Zhaokun Zhou, Yonghong Tian, Bo XU, Guoqi Li",ICLR,2024,C,SNN,https://proceedings.iclr.cc/paper_files/paper/2024/hash/e9882f7f7c44a10acc01132302bac9d8-Abstract-Conference.html,https://proceedings.iclr.cc/paper_files/paper/2024/file/e9882f7f7c44a10acc01132302bac9d8-Paper-Conference.pdf,"Neuromorphic computing, which exploits Spiking Neural Networks (SNNs) on neuromorphic chips, is a promising energy-efficient alternative to traditional AI. CNN-based SNNs are the current mainstream of neuromorphic computing. By contrast, no neuromorphic chips are designed especially for Transformer-based SNNs, which have just emerged, and their performance is only on par with CNN-based SNNs, offering no distinct advantage. In this work, we propose a general Transformer-based SNN architecture, termed as ``Meta-SpikeFormer"", whose goals are: (1) Lower-power , supports the spike-driven paradigm that there is only sparse addition in the network; (2) Versatility , handles various vision tasks; (3) High-performance , shows overwhelming performance advantages over CNN-based SNNs; (4) Meta-architecture , provides inspiration for future next-generation Transformer-based neuromorphic chip designs. Specifically, we extend the Spike-driven Transformer in \citet{yao2023spike} into a meta architecture, and explore the impact of structure, spike-driven self-attention, and skip connection on its performance. On ImageNet-1K, Meta-SpikeFormer achieves 80.0\% top-1 accuracy (55M), surpassing the current state-of-the-art (SOTA) SNN baselines (66M) by 3.7\%. This is the first direct training SNN backbone that can simultaneously supports classification, detection, and segmentation, obtaining SOTA results in SNNs. Finally, we discuss the inspiration of the meta SNN architecture for neuromorphic chip design.",spiking neural network; spike; spiking,Official abstract/page strictly confirms SNN/spiking neural computation; no clear event-camera/DVS evidence found.,01-papers-by-conference/ICLR2024/C/2024-ICLR-C-spike-driven-transformer-v2-meta-spiking-neural-network-architecture-inspiring-the-design-.md,strict two-stage screening; official abstract/page inspected; main conference; needs human verification
ICLR2024-2088,Online Stabilization of Spiking Neural Networks,"Yaoyu Zhu, Jianhao Ding, Tiejun Huang, Xiaodong Xie, Zhaofei Yu",ICLR,2024,C,SNN,https://proceedings.iclr.cc/paper_files/paper/2024/hash/eb261df4322a8bd0a73093c4d8a0d02d-Abstract-Conference.html,https://proceedings.iclr.cc/paper_files/paper/2024/file/eb261df4322a8bd0a73093c4d8a0d02d-Paper-Conference.pdf,"Spiking neural networks (SNNs), attributed to the binary, event-driven nature of spikes, possess heightened biological plausibility and enhanced energy efficiency on neuromorphic hardware compared to analog neural networks (ANNs). Mainstream SNN training schemes apply backpropagation-through-time (BPTT) with surrogate gradients to replace the non-differentiable spike emitting process during backpropagation. While achieving competitive performance, the requirement for storing intermediate information at all time-steps incurs higher memory consumption and fails to fulfill the online property crucial to biological brains. Our work focuses on online training techniques, aiming for memory efficiency while preserving biological plausibility. The limitation of not having access to future information in early time steps in online training has constrained previous efforts to incorporate advantageous modules such as batch normalization. To address this problem, we propose Online Spiking Renormalization (OSR) to ensure consistent parameters between testing and training, and Online Threshold Stabilizer (OTS) to stabilize neuron firing rates across time steps. Furthermore, we design a novel online approach to compute the sample mean and variance over time for OSR. Experiments conducted on various datasets demonstrate the proposed method's superior performance among SNN online training algorithms.Our code is available at https://github.com/zhuyaoyu/SNN-online-normalization.",spiking neural networks; spiking,Official abstract/page strictly confirms SNN/spiking neural computation; no clear event-camera/DVS evidence found.,01-papers-by-conference/ICLR2024/C/2024-ICLR-C-online-stabilization-of-spiking-neural-networks.md,strict two-stage screening; official abstract/page inspected; main conference; needs human verification
ICLR2024-2175,Threaten Spiking Neural Networks through Combining Rate and Temporal Information,"Zecheng Hao, Tong Bu, Xinyu Shi, Zihan Huang, Zhaofei Yu, Tiejun Huang",ICLR,2024,C,SNN,https://proceedings.iclr.cc/paper_files/paper/2024/hash/f5c530d3f287c43dccfca298698e9254-Abstract-Conference.html,https://proceedings.iclr.cc/paper_files/paper/2024/file/f5c530d3f287c43dccfca298698e9254-Paper-Conference.pdf,"Spiking Neural Networks (SNNs) have received widespread attention in academic communities due to their superior spatio-temporal processing capabilities and energy-efficient characteristics. With further in-depth application in various fields, the vulnerability of SNNs under adversarial attack has become a focus of concern. In this paper, we draw inspiration from two mainstream learning algorithms of SNNs and observe that SNN models reserve both rate and temporal information. To better understand the capabilities of these two types of information, we conduct a quantitative analysis separately for each. In addition, we note that the retention degree of temporal information is related to the parameters and input settings of spiking neurons. Building on these insights, we propose a hybrid adversarial attack based on rate and temporal information (HART), which allows for dynamic adjustment of the rate and temporal attributes. Experimental results demonstrate that compared to previous works, HART attack can achieve significant superiority under different attack scenarios, data types, network architecture, time-steps, and model hyper-parameters. These findings call for further exploration into how both types of information can be effectively utilized to enhance the reliability of SNNs. Code is available at https://github.com/hzc1208/HART_Attack .",spiking neural networks; spiking,Official abstract/page strictly confirms SNN/spiking neural computation; no clear event-camera/DVS evidence found.,01-papers-by-conference/ICLR2024/C/2024-ICLR-C-threaten-spiking-neural-networks-through-combining-rate-and-temporal-information.md,strict two-stage screening; official abstract/page inspected; main conference; needs human verification
ICLR2024-2253,Can we get the best of both Binary Neural Networks and Spiking Neural Networks for Efficient Computer Vision?,"Gourav Datta, Zeyu Liu, Peter Beerel",ICLR,2024,C,SNN,https://proceedings.iclr.cc/paper_files/paper/2024/hash/ff521f7570d6ed23217ba5780753a1f7-Abstract-Conference.html,https://proceedings.iclr.cc/paper_files/paper/2024/file/ff521f7570d6ed23217ba5780753a1f7-Paper-Conference.pdf,"Binary Neural networks (BNN) have emerged as an attractive computing paradigm for a wide range of low-power vision tasks. However, state-of-the-art (SOTA) BNNs do not yield any sparsity, and induce a significant number of non-binary operations. On the other hand, activation sparsity can be provided by spiking neural networks (SNN), that too have gained significant traction in recent times. Thanks to this sparsity, SNNs when implemented on neuromorphic hardware, have the potential to be significantly more power-efficient compared to traditional artifical neural networks (ANN). However, SNNs incur multiple time steps to achieve close to SOTA accuracy. Ironically, this increases latency and energy---costs that SNNs were proposed to reduce---and presents itself as a major hurdle in realizing SNNs’ theoretical gains in practice. This raises an intriguing question: Can we obtain SNN-like sparsity and BNN-like accuracy and enjoy the energy-efficiency benefits of both? To answer this question, in this paper, we present a training framework for sparse binary activation neural networks (BANN) using a novel variant of the Hoyer regularizer. We estimate the threshold of each BANN layer as the Hoyer extremum of a clipped version of its activation map, where the clipping value is trained using gradient descent with our Hoyer regularizer. This approach shifts the activation values away from the threshold, thereby mitigating the effect of noise that can otherwise degrade the BANN accuracy. Our approach outperforms existing BNNs, SNNs, and adder neural networks (that also avoid energy-expensive multiplication operations similar to BNNs and SNNs) in terms of the accuracy-FLOPs trade-off for complex image recognition tasks. Downstream experiments on object detection further demonstrate the efficacy of our approach. Lastly, we demonstrate the portability of our approach to SNNs with multiple time steps. Codes are publicly available here .",spiking neural networks; spiking,"Manual boundary check: sparse binary activation neural networks are compared with SNNs and portable to SNNs, but the paper is not an event-camera method.",01-papers-by-conference/ICLR2024/C/2024-ICLR-C-can-we-get-the-best-of-both-binary-neural-networks-and-spiking-neural-networks-for-efficie.md,strict two-stage screening; official abstract/page inspected; main conference; needs human verification
